Judul,Tanggal,Artikel,Category
Legendaris! Gudeg Mbok Lindu yang Lezatnya Langgeng 83 Tahun,"Kamis, 30 Nov 2023 15:00 WIB","Gudeg Mbok Lindu menjadi ikon kuliner legendaris di Kota Jogjakarta. Warung gudeg ini sudah buka sejak 1940 dan kini telah diwariskan ke generasi kedua. Warung Gudeg Mbok Lindu terletak di Jalan Sosrowijayan No 41-43, Sosromenduran, Gedong Tengen, Jogja. Pantauan detikJogja, Jumat (24/11/2023), warung ini tampak ramai pengunjung yang ingin menyantap gudeg legendaris ini. Warung Gudeg Mbok Lindu tempatnya tak terlalu luas. Tampak beberapa pembeli menyantap pesanan sambil duduk di kursi dan meja yang tersedia. SCROLL TO CONTINUE WITH CONTENT Generasi kedua Gudeg Mbok Lindu sekaligus anak ketiga Mbok Lindu, Ratia (54 tahun) mengatakan awalnya Gudeg Mbok Lindu tidak memiliki tempat jualan yang menetap. Mbok Lindu dulunya hanya berjualan keliling dari rumah ke rumah untuk menawarkan dagangannya. ""Yo kalau dulu kan simbah dari tahun 1940 kan sudah jualan gudeg, dari rumah (di daerah UGM) sampai sini (Sosrowijayan) kan jalan kaki. Dulu keliling kayak gitu, tapi akhirnya di daerah sini,"" kata Ratia saat ditemui di warungnya. Mbok Lindu tutup usia pada tahun 2020 lalu. Mbok Lindu meninggal di usianya yang ke-105 tahun. ""Simbah masih (ada) COVID itu, tengah-tengah (tahun pandemi) kalau nggak salah simbah meninggal, itu karena tua. Tahun 2020, COVID baru mulai tapi nggak kena, alhamdulillah,"" ucapnya. ""Meninggale (Mbok Lindu) (usia) 105 tahun,"" tambah Ratia. Kini Gudeg Mbok Lindu sudah memiliki warung yang tetap untuk berjualan. Menurut Ratia, dia sempat berjualan di pinggir jalan sebelum akhirnya membuka warung. ""Kalau ini baru COVID itu aku pindah sini. Simbah masih tapi kan dulunya di daerah sana, di depan. Dulu kan cuma di lesehan gini pinggir ini nggak ada tokonya,"" tuturnya. Ratia juga bercerita rata-rata konsumen Gudeg Mbok Lindu berasal dari kota-kota besar seperti Jakarta dan Bandung. ""(Konsumen) Dari luar kota daerah Jakarta, Bandung gitu, wisatawan,"" tambah Ratia. Untuk jam operasional warung, Gudeg Mbok Lindu buka dari jam 06.00 WIB pagi. Ratia tetap harus menutup warung jika sudah jam 12.00 siang meskipun gudegnya belum habis terjual. ""Jam 06.00 WIB sampai jam segini jam 12.00 WIB, yo habis nggak habis jam segini harus tutup,"" ucapnya. Di hari-hari biasa, kondisi warung Gudeg Mbok Lindu ramai pembeli. Namun, akan bertambah ramai saat akhir pekan tiba. ""Yo tiap hari antre tapi kalau ramai betul-betul ramai Sabtu-Minggu mesti antre panjang,"" terang anak ketiga Mbok Lindu tersebut. Ratia mengaku memasak sendiri gudeg yang bakal dijual. Dia mengolahnya tanpa bantuan karyawan. ""Nggak ada aku masak sendiri, jual sendiri,"" ujarnya sambil tertawa. Menu yang ditawarkan di warung Gudeg Mbok Lindu cukup beragam. Menu utamanya terdiri dari paketan nasi atau bubur gudeg dan krecek ditambah lauk yang bisa dipilih pembeli. ""Heem (menunya sendiri-sendiri), tapi nek itu kan cuma lauknya beda tapi nek krecek sama gudeg ki mesti pakai, sudah satu paket, tapi cuma lauke mau ayam, opo telur itu,"" jelas Ratia. Beberapa pilihan lauk di menu Gudeg Mbok Lindu di antaranya tempe, tahu, telur, ayam suwir, dada, paha, sayap, dan sebagainya. Harganya pun cukup terjangkau mulai dari Rp 15.000 hingga Rp 55.000. Ratia mengungkapkan ciri khas gudeg buatan Mbok Lindu adalah kreceknya. Dia menyebut gudeg buatannya tak terlalu manis seperti gudeg pada umumnya. ""Kalau gitu kadang yang tahu pembeli kadang ada yang bilang kalau di gudeg ini manis, di sini (tempat lain) tidak manis kadang bilang gitu, yang bilang gitu kan pembeli aku cuma dengar. Kalau di sini istimewanya krecek,"" ucap Ratia. Salah satu yang menjadi alasan warung ini langgeng selain tidak memiliki cabang, adalah proses memasaknya yang masih menggunakan kayu bakar. Hal ini menambah cita rasa dan membuatnya konsisten sejak dulu. ""Yo dipertahankan, mesti pakai kayu bakar nggak pakai gas, proses masaknya jadi lama. Jam 1 jam 2 (siang) mulai masak, magrib selesai udah. Jam 2 (pagi) bangun lagi manas-manasin,"" ungkapnya. Di sisi lain, Ratia mengungkapkan keinginannya agar Gudeg Mbok Lindu semakin berkembang. Dia punya cita-cita bisa membuka cabang Gudeg Mbok Lindu. ""Insyaallah kalau ada rezeki mau yang lebih (berkembang), kalau (rencana) buka cabang itu nanti kita kan mesti harus banyak tenaga, mesti masaknya lebih to nanti mesti di (komplain) orang lain (kalau tidak sama dengan sebelumnya), cukup gini aja ndak lain-lain,"" pungkas Ratia. ",Food
Klarifikasi Kiki dan Belinda MCI soal Potong Daging di Grand Final,"Kamis, 30 Nov 2023 14:30 WIB","Disebut tak pantas jadi juara lantaran tak bisa memotong daging, Belinda dan Kiki menceritakan apa yang sebenarnya terjadi. Begini klarifikasinya! MasterChef Indonesia (MCI) telah menemukan juara. Belinda mendapat juara 1 dan Kiki mendapat juara 2. Namun, netizen justru tak terima dengan penobatan juara tersebut. Banyak yang beranggapan bahwa Kiki lebih pantas mendapatkan juara 1 ketimbang Belinda. Apalagi saat grand final, Belinda tampak kesulitan memotong daging hingga dibantu oleh Kiki. SCROLL TO CONTINUE WITH CONTENT Dari hal tersebut banyak spekulasi yang menyebutkan ajang memasak tersebut sebagai acara 'settingan'. Kiki dan Belinda langsung memberikan klarifikasinya saat menjadi bintang tamu di acara talkshow FYP, TRANS7 (29/11/23).  Dari kejadian tersebut banyak pula netizen yang mengira bahwa Kiki dan Belinda bermusuhan. Hal itu langsung dibantah oleh keduanya. Baik Kiki maupun Belinda mengatakan bahwa sebenarnya keduanya adalah teman dekat. Mereka kerap melakukan kegiatan bersama saat karantina selama ajang MCI berlangsung.  Lebih lanjut,Kiki juga mengatakan dirinya menerima penobatan sebagai juara 2. ""Aku terima, karena yang rasain kan kita, aku juga udah ucapin selamat ke Belinda,""tuturnya. Belinda juga mengungkap bahwa ajang tersebut tidak 'settingan' seperti yang disebut oleh netizen. ""Aku yang rasain sendiri ada di situ, acara itu gak sebentar, ini udah 11 season,"" tambah Belinda. Mendapat juara 1, tentu Belinda sangat bersyukur. Meskipun begitu, ia sempat sedih lantaran membaca komentar dari netizen. ""Bersyukur, senang ya pastinya karena ini impian semua orang untuk menang. Kalau baca komentar sedih pasti ada, karena harusnya kita bisa selebrasi,"" tutur Belinda. Soal kejadian di mana Belinda dianggap tak bisa memotong daging hingga harus dibantu oleh Kiki, rupanya Kiki memiliki pandangan tersendiri mengapa ia terpikirkan untuk membantu. Menurutnya, ajang tersebut bukan masalah siapa yang lebih jago. Sebab, kompetisi tersebut ada batasan waktu yang membuat apapun bisa terjadi. Menurut Kiki, saat potong daging domba kemarin, Belinda sudah terbiasa memotong daging pakai alat khusus. Namun, di ajang tersebut diharuskan menggunakan pisau besar. ""Aku bar-bar biasa pakai golok, jadi aku tau selahnya. Itu juga gak langsung aku bantuin, sampai beberapa menit dia coba gak bisa, yaudah aku bantu, daripada jarinya yang kepotong,"" tutur Kiki. Kiki sendiri merupakan pria asal Medan yang merupakan lulusan SMK jurusan Tata Boga. Dengan jurusan yang dipilih tersebut, awalnya Kiki tidak mendapat dukungan dari sang ayah. Namun, hal tersebut tidak menurunkan semangatnya. Ia justru ingin membuktikan bahwa dirinya bisa sukses dengan mengikuti ajang MCI, dan terbukti menyabet juara 2. ""Dulu sempat ditentang, sekarang karena udah buktiin Ayah aku sekarang bangga dan senang banget,"" ujar Kiki. Meskipun hanya lulusan SMK, tetapi Kiki memiliki impian untuk menampilkan kuliner nusantara agar bisa bersaing di dunia. Sementara Belinda merupakan lulusan Le Cordon Bleu di New Zealand. Belinda mendapat dukungan dari orang tuanya untuk memilih sekolah memasak. Namun, untuk mengikuti ajang MC, awalnya ia ditentang juga oleh orang tuanya. Sebab ajang tersebut harus membuat Belinda mengambil cuti dari perkuliahannya. ""Setuju sih, tapi untuk kompetisi gak setuju karena harus cuti kuliah. Tapi setelah menang mereka bangga banget,"" tutup Belinda. ",Food
"Tentrem White Coffee Sido Muncul, Inovasi Kopi 3in1 Kualitas Bintang 5","Kamis, 30 Nov 2023 14:27 WIB","Sido Muncul kini memiliki varian produk kopi premium terbaru. Tentrem White Coffee namanya, yang diluncurkan beberapa waktu lalu di Hotel Tentrem Semarang. Minuman serbuk kopi instan 3 in 1 ini terbuat dari biji kopi pilihan, dengan kualitas rasa white coffee khas Semarang yang kualitasnya tak kalah dari produk-produk luar negeri. Direktur Sido Muncul Irwan Hidayat mengatakan Tentrem White Coffee merupakan langkah baru bagi Sido Muncul dalam menapaki bisnis food and beverage. Pihaknya melihat peluang seiring dengan meningkatnya budaya 'ngopi' di Indonesia. SCROLL TO CONTINUE WITH CONTENT ""Sido Muncul kan awalnya hanya membuat produk jamu, kemudian kami kembangkan terus tak hanya produk jamu saja, tapi merambah ke food supplement dan minuman kesehatan, sekarang kami membuat produk kopi premium White Coffee,"" ujar Irwan dalam keterangan tertulis, Kamis (30/11/2023). Dalam hal ini, Sido Muncul bekerja sama dengan Hotel Tentrem menghadirkan minuman kopi premium dan berkualitas bintang lima yang memiliki aroma terbaik dan rasa yang enak. Dengan takaran 35 gr membuat cita rasa Tentrem White Coffee semakin nikmat. Irwan berharap kehadiran produk baru Tentrem White Coffee dapat diterima di hati masyarakat. ""Ke depannya, Sido Muncul akan terus mengembangkan produk herbal, terutama yang dapat menjaga daya tahan tubuh serta mengatasi panas dalam, masuk angin, dan pegal linu,"" katanya. Diketahui produk kopi yang telah diproduksi Sido Muncul sebelumnya adalah Kopi Jahe Sido Muncul, Kopi Jahe RG (Rendah Gula) Sido Muncul, dan Kuku Bima Kopi Ginseng.  ",Food
"Kamboja Green House, Kafe Bernuasa Bali yang Pernah Disinggahi Menteri - Politisi","Kamis, 30 Nov 2023 13:30 WIB","Sulit mempercayai di kawasan Sasak Panjang, Kabupaten Bogor yang relatif sunyi ada kafe bernuansa Bali yang asri. Kafe dan resto Kamboja Green House, namanya. Toh begitu, kafe yang dipenuhi aneka pepohonan rimbun ini pernah dikunjungi Menteri Pariwisata dan Ekonomi Kreatif Sandiaga Uno. Selain itu politisi senior Fadly Zon hingga penyanyi kini lebih aktif berdakwah, Neno Warisman pernah singgah dan bersantap di kafe dan resto tersebut. ""Kopi Kambojanya terbaik, Saladnya segar, Nasi Balinya sedap. Nuansa Bali? Di Kamboja aja..,"" tulis Sandiaga dalam kertas testimoni yang diunggah ke Instagram Kamboja. Dia bertandang ke kafe tersebut pada 9 Agustus 2023. SCROLL TO CONTINUE WITH CONTENT ""Pak Sandi dan para staf datang dari sore hingga selepas magrib di sini,"" kata pemilik kafe Kamboja Green House Asep Saeppudin Mayah, 58 tahun, saat berbincang dengan detikfood, Selasa (28/11/2023) petang. Kafe tersebut mulai beroperasi pada Juli 2022. Asep bersama istrinya, Mila Maria, awalnya membuka kafe ini lebih dimaksudkan untuk rehat dan kongko mereka yang tengah mencari tanaman. Sebab di lahan seluas 2.500 meter itu semula adalah tempat pembibitan dan perawatan (nursery) aneka tanaman. Sejak 2010 Asep yang meraih gelar insinyur sipil dari ITB menekuni jual beli tanaman fosil jenis Kamboja, Pule, Kenari, Tabebuya, Kikilia (Kigelia Africana), Palem Kurma, Pakis Haji dan lainnya yang punya harga jual puluhan juta rupiah. Karena beberapa menu dan kopi yang disajikan ternyata digemari para pelanggannya, akhirnya Asep membangun kafe dan resto dengan konsep Bali. ""Saya merekrut koki yang sudah lebih dari 20 tahun bekerja di Hotel Ambhara, dan kebetulan dia tinggal di Sawangan. Kebetulan saya dan istri juga suka masak jadi bisa ikut mengontrol langsung soal rasa,"" kata Asep yang mengaku mahir membuat steik dan shabu-shabu. Menu unggulannya antara lain sop dan iga bakar, sate lilit, dan nasi jingo. Namun di kafe ini juga tersedia menu-menu western hingga tomyam, khas Thailand. Sambil menunggu hujan reda petang itu, saya lebih memesan tomyam untuk lebih menghangatkan badan. Asem dan pedasnya nikmat sekali, begitu juga udang, cumi, serta jamurnya terasa fresh. Tak kalah dengan tomyam yang pernah saya santap langsung di Pattaya beberapa waktu silam. Sementara istri saya terlihat begitu menikmati iga bakar yang disebutnya sangat empuk dan bersih dari aroma mrengus. ""Gak pegel ngunyah dan gak bau,"" ujarnya. Nuansa Bali yang ditawarkan Asep dan Mila sempat memicu insiden kecil. Ada keluarga asal Manila yang singgah langsung memesan Babi panggang dan bir. Setelah dijelaskan bahwa lingkungan di sekitar kafe mayoritas kaum muslim sehingga tak mungkin menyiapkan menu haram, akhirnya si tetamu itu mengerti. Sebaliknya pernah juga ada serombongan keluarga yang mempertanyakan kehalalan menu-menu yang disajikan di Kamboja. ""Saya dan istri ya akhirnya buka kartu kalau sudah bergelar haji sehingga dijamin semua menu yang dijual halal,"" kata Asep diimbuhi tawa lebar. Agar tak memicu pertanyaan-pertanyaan serupa dia berencana memajang foto-foto para tokoh yang pernah menikmati menu di Kamboja seperti Sandiaga Uno, Fadly Zon, dan Neno Warisman. Juga menghiasi dinding dengan foto-foto tanaman fosil yang dilengkapi informasi secukupnya. Harapannya, hal ini juga bisa menjadi bahan pembelajaran dan pengenalan pengunjung terhadap berbagai macam tanaman langka dan berharga. ""Lidah nikmat, perut kenyang, wawasan bertambah. Syukur-syukur juga mau membeli tanaman-tanaman fosil di sini,"" canda Asep. ",Food
"Sedih! 35 Tahun Beroperasi, Restoran Populer di Hong Kong Ini Akan Tutup","Kamis, 30 Nov 2023 13:00 WIB","Kabar buruk datang dari salah satu restoran populer di Hong Kong. Restoran yang telah beroperasi selama 35 tahun ini mengabarkan akan menutup gerai dan gedungnya disewa Rp 95 M! Seiring berjalannya waktu, banyak bisnis restoran legendaris yang memutuskan untuk menutup pintu selamanya. Penutupan bisnis kuliner ini bisa disebabkan oleh sejumlah faktor, mulai dari biaya sewa tempat mahal, jumlah pengunjung menurun, pemilik ingin pensiun, atau faktor lainnya. Bagi pelanggan setia, kabar penutupan ini tentu menyedihkan. Namun, setiap bisnis kuliner pasti punya alasan tersendiri menutup gerainya. SCROLL TO CONTINUE WITH CONTENT Belum lama ini, kabar buruk pun datang dari sebuah restoran di Hong Kong. Ma Sa Restaurant diketahui telah menjadi salah satu 'Cha Chaan Teng' atau kafe ala Hong Kong yang disukai banyak orang. Restoran legendaris berlokasi di jalan Sheung Wan's Hillier, Hong Kong ini sering disambangi oleh warga lokal maupun turis internasional. Selama 35 tahun berdiri, Ma Sa Restaurant menawarkan hidangan khas, salah satunya nasi putih dengan tambahan telur dan spam (pork luncheon) goreng, yang kemudian dilengkapi soy sauce, lapor timeout.com (28/11). Menu tersebut mungkin terlihat sangat sederhana, tetapi siapa sangka banyak yang menyukainya. Tidak hanya warga lokal maupun turis yang mampir ke sini, tetapi chef selebriti asal Korea, Baek Jong Won juga belum lama menyambangi Ma Sa Restaurant untuk mencicipi hidangan khas tersebut. Sayang sekali restoran yang dicintai banyak pelanggan ini belum lama memberi kabar akan menutup bisnis kuliner mereka di akhir tahun 2023. Kabar penutupan ini diikuti dengan pemberitahuan terkait gedung restoran yang siap disewa. Menurut laporan berita lokal, gedung restoran tersebut awalnya akan disewa dengan harga 48 juta dollar HK atau sekitar Rp95 miliar. Namun, tiba-tiba harga gedung bekas restoran ini turun menjadi 28 juta dollar HK atau Rp. 55.423.302.368,00. Saat gedung restoran populer ini pertama kali dibeli tahun 1988, pemilik itu perlu mengeluarkan uang sekitar 23,5 juta dollar HK (Rp 46 milliar). Namun, menurut kabar, gedung restoran tersebut telah menjadi properti warisan dan seiring berjalannya waktu harganya pun meningkat. Meskipun disewa dengan harga yang tidak murah, rupanya tetap ada yang tertarik dengan gedung restoran ini. Pembelinya yang sekarang adalah bagian dari Bridgesay Prime Shop Fund. Mereka menganggap restoran ini memang bangunannya sudah tua, berumur 52 tahun. Namun, harga jualnya masih masuk akal mengingat lokasinya strategis di sudut Hiller dan Burd Street. Belum diketahui secara pasti alasan Ma Sa Restaurant akan berhenti beroperasi akhir tahun ini. Namun, dalam waktu dekat restoran yang selalu ramai diantre di siang hari itu tampaknya memang akan berhenti beroperasi. Gedung restorannya pun telah berhasil disewa seharga Rp 55 M. Meskipun begitu, masih ada kemungkinan Ma Sa Restaurant melanjutkan operasinya di lokasi berbeda. ",Food
Unik! 5 Pengantin Ini Pilih Menu yang Tak Biasa untuk Pernikahannya,"Kamis, 30 Nov 2023 12:30 WIB","Pesta pernikahan biasanya dimeriahkan dengan makanan prasmanan yang lezat, beberapa pengantin ini punya menu menarik. Ada yang pilih makanan cepat saji. Pesta pernikahan menjadi salah satu acara terbesar yang akan dilakukan dalam seumur hidup. Dekorasi yang megah, pakaian yang indah, hingga makanan yang lezat untuk menjamu tamu yang hadir harus dipersiapkan dengan matang. Biasanya para pengantin akan memilih makanan dalam bentuk prasmanan guna memudahkan tamu mengambil makanan sesuai seleranya. Tetapi ada beberapa pengantin yang justru menyajikan makanan-makanan di luar ekspektasi. SCROLL TO CONTINUE WITH CONTENT Beberapa kisah pengantin berhasil viral lantaran menyajikan makanan cepat saji dalam pesta pernikahannya. Alasannya beragam, mulai dari makanan favorit pengantinnya hingga alasan-alasan unik lainnya. Baca juga: 5 Tips Berhenti Minum Kopi Tanpa Sakit Kepala, Contek Yuk! Pengantin asal Singapura ini memiliki konsep yang unik dalam memilih tema pesta pernikahannya. Sebagai penggemar restoran cepat saji, keduanya memilih KFC sebagai konsep pernikahan yang sakral. Pengantin wanita bernama Wong Liang Le mengungkapkan bahwa pernikahan dengan tema KFC ini merupakan impiannya sejak lama. Wadah-wadah prasmanan di pestanya dipenuhi dengan ayam goreng original dan crispy dari KFC. Bukan hanya menyukai menu makannya, Wong mengatakan bahwa kencan pertama dengan suaminya juga dilakukan di salah satu gerai KFC. Bahkan ia juga memesan souvenir pernikahan kepada pihak restoran cepat saji. Berawal dari ulah iseng, sepasang pengantin mendapat kiriman minuman favoritnya untuk disajikan dalam acara pernikahan. Gillian dan suaminya mengundang para CEO dari makanan dan minuman favoritnya. Tak hanya restoran, bahkan perusahaan lain yang layanannya seringkali mereka andalkan juga diundang. Sayangnya tak ada satu CEO pun yang datang tetapi mereka menerima banyak hadiah dalam acara pernikahannya. Terlihat pada salah satu sudut meja makan ada tumpukan bubble tea yang dikirimkan oleh merek KOI. Selain itu Gillian juga menerima banyak hadiah Mcnugget dari CEO McDonald's yang diundangnya. ",Food
Duh! Bocah Ini Dilarikan ke Rumah Sakit Usai Makan Tokek Goreng,"Kamis, 30 Nov 2023 11:30 WIB","Bocah berusia sebelas tahun ini harus dilarikan ke rumah sakit usai karena tercemar bakteri. Gegara ia menyantap tokek goreng yang dimasak oleh ibu tirinya. Tokek termasuk reptil yang sering disebut sebagai cicak besar yang memiliki corak dan warna kulit yang cerah. Sama seperti daging reptil lainnya, konsumsi daging tokek masih menimbulkan pro dan kontra. Ada yang menyebutnya berbahaya dan sebaliknya. Baru-baru ini di Brazil ada seorang bocah laki-laki yang jatuh sakit setelah dia menyantap daging tokek yang digoreng. Dilansir dari DailyMailUK (29/11), bocah yang namanya tak disebutkan ini mengalami muntah-muntah hingga lemas usai menyantap tokek. SCROLL TO CONTINUE WITH CONTENT Kasus ini bermula ketika bocah ini hampir saja membunuh tokek saat dia sedang main. Kemudian bocah ini dihampiri oleh sang ibu dan ibu tirinya yang berada di sana. Kemudian mereka setuju untuk menyiapkan makanan dari daging tokek jika bocah ini menangkap lebih banyak tokek. Karena penasaran dengan rasa daging tokek, bocah ini langsung menangkap empat ekor tokek untuk dimasak di rumah. Ibu tirinya yang bernama Raquel de Souza langsung membersihkan tokek tersebut, kemudian dibumbui sebelum digoreng lalu dimakan bocah tersebut. Tak lama setelah bocah ini menyantap daging tokek, dia mulai mengalami sakit kepala, bagian lidahnya bengkak, diare, muntah-muntah sampai urinenya berwarna gelap. Bocah ini langsung dilarikan ke rumah sakit dan sudah sempat pulang ke rumah tapi kondisi kesehatannya terus menurun. Sampai akhirnya pihak keluarga membawanya lagi untuk dirawat di rumah sakit. Setelah diteliti oleh dokter, ditemukan bahwa fungsi usus dari bocah ini terganggu karena banyaknya bakteri di dalam tubuhnya.Karena itu bocah ini hanya boleh makan buah dan air kelapa saja untuk memulihkan kondisinya. ""Semenjak dia makan tokek, dia mulai jatuh sakit disusul dengan demam sampai tak nafsu makan,"" sambung de Souza. Menurut Marcelo Daher selaku dokter yang menangani bocah ini, salah satu penyebab bocah ini jatuh sakit kemungkinan besar karena tokek yang dimakannya sudah terinfeksi dengan parasit berbahaya. ""Ada risiko alergi dan kesehatan yang serius. Jadi setiap orang harus berhati-hati saat memakan daging hewan liar,"" saran Marcelo. Sementara untuk De Souza, pihak berwajib belum memutuskan apakah De Souza bersalah atau tidak karena wanita ini tidak memaksa anak tirinya untuk makan daging tokek tersebut.  ",Food
"Resep Tumis Kangkung Bumbu Tauco, Renyah Segar Untuk Lauk Makan Siang","Kamis, 30 Nov 2023 11:00 WIB","Meskipun murah meriah, kangkung juga kaya nutrisi. Enak ditumis dengan bumbu tauco yang asin gurih dengan tambahan cabe yang pedas menyengat. Salah satu sayuran yang populer karena harganya terjangkau adalah kangkung. Kangkung bisa diolah gaya rumahan hingga restoran. Seperti tumis kangkung yang populer dan digemari banyak orang. Yang satu ini memakai paduan irisan daging sapi hingga rasanya jadi gurih enak. Sementara bumbunya memakai bawang, tauci dan cabe. Rasa asin gurih dan aroma khas tauco membuat tumisan ini lezat. SCROLL TO CONTINUE WITH CONTENT Yang penting gunakan kangkung yang muda, daun dan batangnya lalu pakai api besar saat menumis. Berikut ini bahan-bahan untuk bumbu dan langkah pembuatannya yang mudah diikuti. Bumbu tauco dan irisan daging membuat tumis kangkung ini semakin gurih enak rasanya. 1. Untuk kangkung bisa dipakai kangkung cabut, kangkung organik atau kangkung sawah. Petiki daun dan batang yang muda saja. 2. Agar mendapatkan rasa asin gurih, gunakan tauco berkualitas bagus. Tidak terlalu gelap warnanya dengan biji kedelai yang memar dan utuh. ",Food
Resep Tumis Kerang Bumbu Cabe dan Kemangi yang Pedas Sedap Rasanya,"Kamis, 30 Nov 2023 10:00 WIB","Kerang putih yang berdaging kenya gurih semakin enak ditumis dengan bumbu cabe. Aromanya semakin harum dengan tambahan daun kemangi segar. Kerang sangat banyak jenisnya. Yang umum diolah adalah kerang putih, kerang dara dan kerang hijau. Daging kerang yang kenyal gurih cocok dipadukan dengan bumbu cabe dan rempah. Kerang putih yang gurih bisa diolah dengan bumbu cabe yang pedas menyengat sehingga rasanya makin sedap menyengat. Ditambah daun kemangi segar, aromanya jadi harum tanpa anyir. SCROLL TO CONTINUE WITH CONTENT Gunakan hanya kerang segar atau hidup agar tak beraroma anyir tetapi gurih enak. Berikut ini resep tumis kerang bumbu cabe selengkapnya berikut tips membuatnya yang gampang dicontek. Gurih pedas tumis kerang ini cocok dipadukan dengan nasi hangat. 1. Pastikan membeli kerang dalam keadaan segar dan hidup. Sebelum direbus cuci dan sikat kerang agar kotorannya larut, bilas hingga bersih. 2. Jika suka pedas, cabe merah bisa diganti dengan cabe rawit merah yang diiris kasar. ",Food
3 Resep Jamur Goreng Tepung yang Renyah Gurih dan Juicy,"Kamis, 30 Nov 2023 09:00 WIB","Jamur yang kaya protein juga enak dibuat gorengan. Dilapisi adonan tepung lalu digoreng kering. Dari jamur enoki, shitake dan jamur kancing yang segar. Jamur merupakan salah satu jenis sayuran yang ada sepanjang musim dengan harga terjangkau. Selain serat dan vitamin, jamur juga kaya mineral dan rasanya segar juicy dan umami. Selain ditumis, jamur juga enak digoreng dengan lapisan tepung. Seperti jamur shitake dibuat tempura yang renyah. Atau jamur kancing yang digoreng dengan lapisan tepung panir. SCROLL TO CONTINUE WITH CONTENT Lebih enak lagi jamur enoki yang dibalur adonan tepung dan digoreng kering. Jamur goreng ini enak dimakan dengan cocolan saus cabe dan mayones. Tiga rese jamur goreng tepung ini bisa jadi gorengan enak lauk nasi. Jamur mungil seperti jarum ini jadi renyah gurih dengan balutan tepung. Enak dimakan hangat dengan cocolan saus cabe.    Jamur shitake yang empuk juicy dengan rasa umami semakin enak rasanya dengan balutan adonan tempura. Renyah juicy dan gurih.    Lapisan tepung panir yang garing renyah membuat jamur kancing yang empuk padat jadi semakin enak. Apalagi dicocol mayones.     ",Food
