Judul,Tanggal,Artikel,Category
"Ibu Ini Berhenti Memasak untuk Calon Menantu, Ini Penyebabnya","Selasa, 05 Des 2023 13:00 WIB","Sudah terbiasa masak untuk calon menantunya, ibu ini mendadak berhenti masak. Karena ia kesal dengan kelakuan calon menantunya. Hubungan antara ibu mertua dengan menantu perempuan memang seringkali mengundang perdebatan. Tapi ternyata perselisihan ini sudah bisa ditemukan saat keduanya belum menjadi keluarga, atau masih menjadi calon ibu mertua dan calon menantu perempuan. Kisah inilah yang dibagikan pengguna Reddit secara anonim. Dilansir dari DailyMailUK (04/12), ibu yang satu ini memutuskan untuk berhenti masak dan membuatkan makanan untuk calon menantunya. Meski calon menantunya itu sudah berhubungan dengan putranya selama lebih dari enam tahun. SCROLL TO CONTINUE WITH CONTENT Alasannya sederhana karena sang ibu merasa calon menantunya itu tidak suka dengan rasa masakannya. Apalagi keduanya datang dari budaya kuliner yang berbeda. ""Saya datang dari budaya yang berbeda dengan mereka, jadi saya merasa pacar anak saya ini tidak suka dengan rempah yang saya gunakan. Bahkan masakan sesederhana apapun, calon menantu saya tetap tidak akan memakannya. Saya sudah tanya ke putra saya akan hal ini, dia bilang pacarnya memang suka pilih-pilih makanan,"" curhat ibu tersebut. Sang ibu juga melihat bahwa calon menantunya sering membuang makanannya. Sampai sang ibu kesal dan memutuskan tidak akan memasak apapun untuk anaknya dan calon menantunya itu. ""Mereka seharusnya besok datang ke rumah, tapi saya bilang ke putra saya bahwa saya tidak akan memasak lagi. Karena saya lelah masakan saya tidak pernah pacarnya makan. Jadi buang-buang waktu saja. Lebih baik saya pesankan mereka pizza,"" sambung ibu ini. Namun sang putra justru kecewa mendengar jawaban sang ibu, karena putranya rindu masakan rumahan yang dibuat sang ibu. Menanggapi curhatan ini banyak netizen yang memberikan komentar beragam. Ada yang pro dan kontra. ""Mungkin saja pacar putramu itu punya gangguan makan. Lebih baik tanya putramu baik-baik apakah pacarnya itu tengah berjuang dengan gangguan makanan atau penyakit lainnya,"" saran netizen. ""Menurut saya calon menantu ini memiliki gangguan makanan. Soalnya saya pernah punya teman yang kelakuannya seperti dia,"" sambung netizen. Ibu ini kembali menjelaskan bahwa sebelumnya dia sudah mencoba berbicara ke putranya masalah ini. ""Menurut saya, wanita ini berpikir masakan saya tidak enak. Soalnya saya pernah lihat dia makan makanan lain, jadi saya rasa dia tidak memiliki gangguan makanan,"" pungkas ibu itu. Sebelumnya di Reddit ada banyak curhatan yang berkaitan dengan makanan. Seperti curhatan seorang pria anonim yang bingung karena kekasihnya selalu kesal setiap kali dia menyantap makanan sehat.    ",Food
"Ada Staples di Dalam Gorengan, Lidah Anak Ini Terluka","Selasa, 05 Des 2023 12:30 WIB","Tak sengaja temukan staples yang ada di dalam gorengan nangka. Lidah anak perempuan ini terluka karena kelalaian penjual gorengan. Staples umum digunakan untuk merekatkan kertas hingga kotak. Staples yang terbuat dari logam memiliki ujung yang tajam sehingga penggunaannya tidak disarankan untuk kemasan makanan. Karena bisa membahayakan orang jika tak sengaja memakan staples. Namun nyatanya masih banyak penjual makanan terutama pedagang kaki lima yang masih menggunakan staples, untuk mengecangkan kemasan makanan mereka. Seperti kisah yang dibagikan pengguna Facebook asal Malaysia bernama Izza Howzin (04/12), ia menceritakan pengalaman tak terduga saat jajan gorengan. SCROLL TO CONTINUE WITH CONTENT Awalnya ia membeli gorengan nangka lalu memakannya bersama putrinya yang masih kecil. Awalnya memang tidak ada yang salah, sampai ia menemukan banyaknya staples di dalam kulit gorengan tersebut. Lidah putrinya ikut terluka karena tak sengaja memakan gorengan yang adonan kulitnya terkontaminasi staples. ""Setelah saya mengeceknya, saya menemukan ada beberapa biji staples di dalam kulit gorengannya. Tidak ada yang sengaja menaruh staples itu ke dalam adonan, saya tahu bahwa penjual juga tidak tahu akan hal ini. Tapi tetap saja tindakan ini merupakan kelalaian dari penjual makanan,"" tutur Izza. Izza merasa masih beruntung karena anaknya sudah bisa mengenal staples sehingga hanya melukai bagian lidahnya saja. ""Anak saya masih beruntung karena bisa melepas staples yang menancap di lidahnya. Kejadian ini bisa berakibat fatal jika menimpa anak yang lebih kecil. Bahkan saya saja tidak mengizinkan anak saya makan ikan sendirian, karena takut durinya tersangkut di tenggorokan,"" sambung Izza. Izza memutuskan untuk tidak komplain ke penjual gorengan tersebut karena ia merasa sudah terlambat. Tujuannya membagikan kisah ini agar orang-orang lebih berhati-hati sebelum menyantap makanan dari luar. Banyak juga pengguna Facebook lainnya yang membagikan pengalaman serupa. ""Saya pernah mengalami pengalaman yang mirip. Saat itu saya beli kue Seri Muka, pas saya gigit kuenya langsung terasa staples. Itu kejadian yang mengerikan,"" curhat salah satu netizen. ""Sama seperti saya ketika makan nasi ketan dan menemukan staples. Untungnya saya sadar ada yang aneh di ketan itu dan langsung mengeluarkannya,"" komen netizen lainnya. Banyak netizen yang merasa bahwa kemasan makanan dengan staples cukup berbahaya, dan seharusnya diganti dengan karet atau perekat lainnya yang lebih aman.   ",Food
Nenek Vietnam Ini Bertahan Hidup dengan Minum Soft Drink Selama 50 Tahun,"Selasa, 05 Des 2023 11:30 WIB","Nenek asal Vietnam ini tidak menyantap makanan apa-apa selama puluhan tahun. Ia bertahan hidup selama puluhan tahun dengan minum minuman ringan. Minuman ringan atau soft drink identik dengan minuman kemasan yang mengandung banyak pemanis buatan hingga pengawet. Sehingga konsumsi minuman ringan ini banyak dihindari orang, apalagi jika diminum secara terus menerus karena bisa menyebabkan masalah kesehatan yang serius. Namun berbeda dengan wnaita asal Vietnam bernama Bui Thi Loi yang tinggal di Loc Ninh. Dilansir dari Oddity Central (04/12), nenek yang satu ini punya pola makan yang cukup mengejutkan dan berbeda dari yang lain. SCROLL TO CONTINUE WITH CONTENT Dia mengaku sudah tidak pernah menyantap makanan padat lagi. Selama lebih dari 50 tahun dirinya hanya mengandalkan air putih dan soft drink saja untuk bertahan hidup. Semuanya bermula di tahun 1963 ketika ia tersambar petir, saat ia dan beberapa temannya mendaki gunung untuk mengobati prajurit yang terluka ketika perang. Saat itu dirinya langsung tak sadarkan diri, meski dia selamat dari sambaran petir tapi kondisi tubuhnya tak lama lagi. Dia menolak menyantap makanan apapun setelah tersambar petir, sehingga teman-temannya mulai memberikannya air manis. Berapa tahun setelah kejadian tersambar petir, Bui Thi Loi mulai menyantap makanan padat terutama buah, karena dipaksa oleh keluarganya meski ia merasa dirinya tak perlu makan. Lalu di tahun 1970 akhirnya ia berhenti menyantap makanan padat. Ia bertahan hidup dengan minum air putih dan soft drink. Kulkas di rumahnya dipenuhi botol-botol minuman serta minuman manis. Kini usia Bui sudah 75 tahun dan ketika mencium aroma makanan dia langsung mual. Padahal setiap hari dia selalu masak makanan untuk anak-anaknya. Ketika anak-anaknya sudah besar, ia tak pernah masak lagi sampai bagian dapurnya berdebu. Walau pola makannya ini bisa dibilang cukup berbahaya untuk kesehatan, tapi Bui merasa tubuhnya tetap sehat dan berenergi meski hanya minum soft drink saja. Menurut penjelasan beberapa dokter dari Department of Nutrition di Vietnam-Cuba Friendship Hospital, minuman manis dari soft drink tersebut bisa menggantikan energi pada tubuh dengan cepat. Akan tetapi soft drink ini bisa berbahaya untuk kesehatan seseorang, karena bisa memicu diabetes, tekanan darah tinggi hingga penyakit jantung. Bui bukan satu-satunya orang yang bertahan hidup dengan minuman manis. Sebelumnya ada pria berusia 58 tahun bernama Gholamreza Ardeshiri ini mengklaim bahwa mengonsumsi makanan biasa membuat dirinya mual.Karena itu ia tak memiliki pilihan lain, selain minum air putih dan minuman bersoda seperti Pepsi, Coca-cola selama 17 tahun terakhir.   ",Food
Resep Ramen Udang Kuah Kaldu Gurih Mantap Untuk Penghangat Badan,"Selasa, 05 Des 2023 11:00 WIB","Ramen dengan paduan udang dan kaldu udang ini rasanya gurih mantap. Disajikan hangat dengan cabe rawit dan air jeruk nipis, rasanya jadi pedas menyegarkan. Saat cuaca dingin, ramen dengan kuah kaldu gurih bisa jadi pilihan tepat untuk penghangat badan. Kalau bosan dengan paduan daging ayam bisa dipakai isian udang segar. Bukan hanya daging udang, kulit dan kepalanya bisa dimanfaatkan untuk kaldu. Agar kuahnya lebih gurih mantap. Ramen udang ini semakin enak dipadukan dengan irisan cabe rawit dan kucuran air jeruk nipis. SCROLL TO CONTINUE WITH CONTENT Jika ingin makan malam yang praktus, ramen udang inii bisa jadi pilihan. Berikut ini daftar bahan-bahan yang diperlukan berikut tips dan cara membuatnya. Sajian ramen udang yang gurih ini cocok untuk penghangat badan. 1. Ramen bisa diganti dengan kwetiau kering atau segar atau mie telur segar. 2. Jika suka, tambahkan sayuran seperti wortel, sawi atau biji jagung manis. ",Food
"4 Driver Ojol Ini Ditraktir Bule di Bali, Cicip Tacos hingga Makanan Lebanon","Senin, 04 Des 2023 15:30 WIB","Seorang bule yang tinggal di Bali mengajak beberapa driver ojek online (ojol) untuk menikmati makanan bersamanya. Mulai dari mencicipi tacos hingga makanan Lebanon. Kisah seputar driver ojek online (ojol) kerap mencuri perhatian. Tak hanya kisah menyedihkan, tapi juga yang menyenangkan. Seperti momen para driver ojol ditraktir makanan. Momen driver ojol ditraktir makan ini diunggah oleh dua orang bule dalam konten video di TikTok @rescue_2000. Bule yang tinggal di Bali itu tampak berkenalan oleh beberapa ojol dan mengajak mereka makan di sebuah restoran. SCROLL TO CONTINUE WITH CONTENT Duo bule ini memilih restoran yang menunya tidak familiar oleh driver ojol. Kebanyakan yang dipilih adalah kuliner mancanegara. Pada 6 November lalu, bule ini mengajak seorang driver ojol bernama Yan untuk makan bersamanya. Bule bernama Elias ini mengajaknya makan di restoran Prancis bernama Little Frenchie Bali. Menu pertama yang dicicipi oleh bule itu adalah sup bawang ala Prancis yang disajikan bersama keju comte dan roti. Sayangnya, ojol tersebut tak menyukainya. Setelahnya, ia menikmati escargot dan bule ini cukup menikmatinya. ""Enak sekali, saya kasih nilai 9 dari 10,"" ungkapnya. Ojol ini juga mencicipi beef tartare, olahan daging mentah. Meski mentah, ternyata driver ojol itu cukup menyukainya. Bule ini juga pernah mentraktir driver ojol untuk mencicipi makanan Jepang. Ia membawa driver tersebut ke restoran bernama Yuki Uluwatu. Hidangan Jepang yang dipesan sangat beragam. Di antaranya ada sushi dengan topping salmon, ayam goreng popcorn, dan steak. Baru pertama kali mencicipinya, ternyata driver ojol ini menyukai sushi salmon itu. Untuk menu ayam goreng popcorn, driver ojol itu ternyata tak begitu menyukainya. Menu yang paling disukai driver itu adalah T-bone steak. Driver ojol itu menyebutkan kalau steak tersebut sangat enak dan memberikannya nilai 10. ""Sangat enak! Terima kasih kawan, ini makanan (steak) terbaik,"" ungkap sang driver ojol. ",Food
Martabak Manis dari Fujian Jadi Menu Makan Malam Pekerja Tambang Timah,"Senin, 04 Des 2023 15:00 WIB","Martabak manis merupakan salah satu kudapan manis yang populer di berbagai daerah di Indonesia. Dijajakan di kaki lima di malam hari yang punya sejarah unik. Makanan ini punya julukan atau nama yang berbeda-beda di setiap daerah. Kalau di Bangka, martabak dikenal juga dengan nama Hoklopan. Asal-usul Nama Martabak Bangka atau Hoklopan SCROLL TO CONTINUE WITH CONTENT Hoklopan berasal dari akar kata 'hoklo' dan 'pan' yang berarti makanan orang Hoklo atau Hokian. Sedangkan sebutan 'kue panekuk' sendiri berasal dari proses pembuatannya. Yakni adonan yang sudah matang diangkat dari loyang kemudian ditekuk atau dilipat. Baru setelah itu dipotong-potong. Ada lagi nama lainnya, yaitu kue tabok. Nama ini diambil dari proses memasaknya, di mana bagian atas martabak biasanya ditabok atau ditampar, lalu diolesi mentega dan diberi topping. Sejarahnya, hoklopan merupakan makanan dari China. Tepatnya Provinsi Fujian. Martabak dibawa oleh orang China yang datang ke Pulau Bangka sebagai pekerja tambang timah. Umumnya mereka berlatar belakang suku Hakka atau Kek dan suku Hokian atau Hoklo. Sejarawan dan budayawan Bangka Belitung, Akhmad Elvian menjelaskan bahwa para pekerja tambang timah asal China ini datang pada masa Kesultanan Palembang Darussalam, Sultan Susuhunan Mahmud Badaruddin I Jayowikramo. Tepatnya pada sekitar tahun 1724-1757 Masehi. Sebelumnya, pada tahun 1710, Kesultanan Palembang Darussalam di bawah kepemimpinan Sultan Muhammad Mansyur Jayo Ing Lago telah menandatangani perjanjian kontrak perdagangan timah dengan VOC. ""Kontrak perdagangan timah dengan VOC diperbaharui setiap setahun sekali. Tujuannya untuk memenuhi jumlah kuota timah sekitar 30.000 pikul setiap tahun. Jadi, Sultan Mahmud Badaruddin I Jayowikramo harus mendatangkan tenaga-tenaga kerja terampil di bidang pertambangan timah yaitu orang China dan orang Melayu,"" jelas Akhmad Elvian kepada detikSumbagsel, Jumat (27/10/2023). Atas usaha dari tokoh bernama Entjek Wan Serin, didatangkanlah orang China dan Melayu dari Johor, Siantan, Semenanjung Malaka, Vietnam, Laos, dan Patani ke Pulau Bangka untuk menambang timah. Singkat cerita, kebijakan mendatangkan orang orang China untuk menambang timah kemudian dilanjutkan pada masa pendudukan Inggris, 1812-1816. Mereka didatangkan dari Kanton, total sekitar 1.600 pekerja pria. Kemudian tahun 1816 pada masa Hindia Belanda, mulai didatangkan pekerja tambang timah dari China Selatan. Kembali ke sejarah martabak Bangka. Selain bekerja sebagai penambang timah, masyarakat China yang datang ini memiliki banyak keahlian. Di antaranya bertukang, berkebun, beternak, hingga mengolah makanan. Salah satu makanan yang banyak diolah adalah martabak atau hoklopan tadi. Dulu, Hoklopan atau martabak ini dibuat sebagai pengganti nasi, khususnya pada malam hari. Sebab, pada zaman itu beras sulit didapatkan di daerah Bangka. Saat itu, proses memasak adonan martabak masih tradisional, yakni menggunakan arang dengan alas menggunakan loyang terbuat dari logam (besi atau tembaga). Untuk adonan Hoklopan dibuat tepung terigu atau mianfu. ""Awalnya dulu cuma ada dua jenis topping, yaitu dari kacang tanah dan wijen. Sebagai pengganti nasi pada malam hari, Hoklopan merupakan makanan rumah tangga dan dibuat satu kali adonan hanya untuk satu kali pembuatan,"" kata Elvian. Kemudian seiring waktu, hoklopan yang awalnya merupakan makanan rumahan mulai dijual atau dipasarkan. Yakni untuk makan malam dan sarapan pagi bagi masyarakat Bangka. ""Pada saat awalnya Hoklopan belum dijual utuh, akan tetapi dijual per potong dengan diwadahi lapisan kertas,"" sambungnya. Saat itu Hoklopan dikenal sebagai makanan rumahan. Jadi, meskipun dijual, martabak ini hanya diberi brand nama atau keluarga pembuatnya saja. Namun siapa sangka, sekarang hoklopan dikenal luas bahkan skala nasional, dengan nama martabak Bangka. Makanan ini pun menjadi bagian dari pariwisata, terutama sebagai gastronomi, gastrodestinasi, dan gastrodiplomasi bagi masyarakat Bangka. Baca sejarah martabak manis selengkapnya di sini! ",Food
Sania Baking Class: 5 Resep Kue Spesial Tahun Baru Bonus Mikser dan Loyang Gratis,"Senin, 04 Des 2023 14:30 WIB","Menjelang akhir 2023, cooking class detikfood menampilkan kue tahun baru dari chef Yongki. Ada banyak hadiah keren juga akan dibagikan. Buruan daftar di sini! 'Cooking & Baking Class' detikfood kembali menghadirkan ahli pastry senior, Yongki Gunawan. Dengan pengalaman puluhan tahun chef Yongki akan menyakikan kue-kue cantik yang spesial tampilannya untuk Natal atau Tahun Baru. Nastar yang jadi kue kering ikonik Natal dan Tahun Baru dijadikan inspirasi untuk membuat kue lain. Ada Rollcake dengan paduan nastar petite four dan pie nanas almond. Keduanya legit renyah. SCROLL TO CONTINUE WITH CONTENT Cokelat juga jadi pilihan untuk kue tahun baru karena favorit banyak orang. Chef Yongki akan membuat cake cokelat dengan paduan kacang mete dan cake kujus lapis keju. Semuanya akan dibeberkan cara membuat berikut tips dan triknya. Berikut ini 5 kue spesial buat akhir tahun yang dipilih chef Yongki Gunawan sesuai tren saat ini berikut tips anti gagal. 1. Chocolate Cashew Nut Cake2. Nastar Petit Four Roll Cake3. Cokelat Lapis Keju Kukus4. Pie Nastar Almond5. Honey Banana Cake Jika kamu senang membuat kue dan ingin mencari ide jualan di akhir tahun atau menambah menu jualan di tahun baru, Baking Class bersama Tepung Terigu Sania ini cocok buat kamu. Catat waktunya: Hari/Tanggal : Sabtu, 9 Desember 2023Jam : 10.00 - 14.00Tempat : Ballroom 3, 5th floor, Vertu Harmoni Jakarta,Jl. Hayam Wuruk No. 6, Jakarta Pusat Cooking class ini didukung oleh Tepung Terigu Sania. Bersiaplah untuk mendapat banyak ilmu goodie bag menarik selama cooking class. Ada hadiah berupa Hand Mixer, Frying Pan dan loyang premium bagi yang beruntung dan banyak hadiah kejutan lainnya. Untuk ikut serta dalam cooking class ini kamu cukup membayar Rp 200.000 per orang atau 3 orang Rp 500.000. Segera daftarkan diri di LINK INI ! Tempat terbatas!  ",Food
BCL dan Tiko Sajikan Menu Tradisional Bali di Pesta Penikahan,"Senin, 04 Des 2023 13:30 WIB","Baru saja menggelar pernikahan, menu di pesta BCL dan Tiko dibocorkan Luna Maya. Ini fakta sajian pernikahan yang kental citarasa tradisional khas Bali. Publik dikejutkan dengan pernikahan Bunga Citra Lestari dan Tiko Aryawardhana yang berlangsung pekan lalu. Pernikahan keduanya dilakukan secara tertutup dan hanya dihadiri oleh keluarga serta sahabat-sahabatnya. Sebuah resort dengan villa dan restoran yang mewah Amankila di Bali dipilih oleh BCL dan Tiko sebagai tempat pernikahannya yang sakral. Luna Maya, selaku sahabat dari BCL, membagikan momennya saat menghadiri pernikahan BCL dan Tiko. SCROLL TO CONTINUE WITH CONTENT Ada bocoran menu makanan melalui Instagram story yang diunggah oleh Luna Maya. Beberapa fakta tentang lokasi dan menu makanan yang dihidangkan oleh BCL dalam pernikahannya telah dirangkum oleh detikfood. Bunga Citra Lestari dan Tiko Aryawardhana memilih untuk melangsungkan pernikahannya dengan tema outdoor. Saat mengucap janji suci atau akad nikah, area yang dipilih pasangan ini langsung menghadap laut lepas. Bahkan pada acara after party atau pesta setelahnya mereka juga memilih restoran dengan konsep semi terbuka. Tempat makan yang dipilih untuk acara tersebut masih berada di dalam area Amankila, Bali. Pemandangan langsung menghadap laut lepas dengan dekorasi bunga-bunga segar dan sentuhan lampu berwarna biru memeriahkan malam pernikahan BCL dan Tiko. Beberapa tamu ditempatkan dalam satu meja yang sama dengan daftar menu makanan yang tertulis pada setiap mejanya. Sup Cram Cam menjadi salah satu menu pada pesta pernikahan BCL dan Tiko yang menyambut para tamu pertama kali di meja makan. Sup khas Bali ini terbuat dari daging ayam yang sudah dipisahkan dari kulit dan tulangnya kemudian dicincang halus. Kuahnya yang menggunakan berbagai campuran rempah menghadirkan rasa gurih yang sedap. Ada kisah unik dibalik menu Cram Cam khas Bali yang ternyata dahulu disajikan setelah pertarungan sabung ayam. Di masa lampau masyarakat Bali menyajikan sup ini menggunakan daging ayam yang kalah bergabung pada sabung ayam. Pemilik ayamnya akan menyembelih dan mencincang dagingnya kemudian mengolahnya sebagai cram cam untuk diberikan kepada keluarga pemenang sabung ayam. ",Food
Laris Manis! Tipat Cantok Mie Warung Dot Raih Omzet Rp 50 Juta Sebulan,"Senin, 04 Des 2023 13:00 WIB","Terinspirasi dari kuliner khas Bandung yang mengawinkan makanan khasnya dengan mie. Warung Dot Lalah hadir dengan menawarkan menu tipat cantok mie. Jika tipat cantok biasanya hanya berisi lontong, beragam sayuran, dan bumbu yang pedas gurih. Namun, tipat cantok yang satu ini berbeda dengan yang lain karena menambahkan mie di dalam racikannya. Pemilik Warung Dot Lalah Made Bimantara mengatakan awalnya ingin membuka warung dengan menu unik dan menemukan kuliner paduan makanan khas Bandung dengan mie. SCROLL TO CONTINUE WITH CONTENT ""Kalau di luar Bali sih udah ada banyak ya mi dicampur sama bumbu kacang, kayak batagor, ketoprak. Terus kalau di Bali kan punya menu tipat cantok, spesialnya Bali kan, kurang lebih mirip-miriplah biasanya itu bumbu kacang,"" jelas pria berusia 30 tahun itu, Sabtu (12/2/2023). Warung yang berlokasi di Jalan Kebak Sari, No.21 Denpasar, ini buka setiap hari mulai pukul 11.00 Wita sampai jam 19.00 Wita. Namun, Made mengaku terkadang mereka bisa saja tutup lebih cepat jika semua menu sudah habis. Suasana Warung Dot Lalah sangat asri. Pembeli dapat menikmati sajian yang dipesan dengan pemandangan rumah khas Bali dengan tanaman rindang di sekitarnya. Warung ini selain memiliki menu kuliner dengan rasa enak, harganya pun ramah di kantong, mulai Rp 8 ribu sampai Rp 20 ribu. Pengusaha yang juga konten kreator ini mengaku sempat kaget dengan antusiasme pembeli, yakni mencapai 200 orang per hari. Sebab Made baru membuka warungnya bersama keluarga sekitar dua setengah bulan yang lalu. Warung ini selain memiliki menu kuliner dengan rasa enak, harganya pun ramah di kantong, mulai Rp 8 ribu sampai Rp 20 ribu. Pengusaha yang juga konten kreator ini mengaku sempat kaget dengan antusiasme pembeli, yakni mencapai 200 orang per hari. Sebab Made baru membuka warungnya bersama keluarga sekitar dua setengah bulan yang lalu. ""Mereka pada suka sih, banyak yang penasaran awalnya karena lihat dari sosial media, tapi akhirnya mereka pada balik lagi,"" tuturnya. Pria asal Denpasar ini menyebut sebulan omsetnya bisa mencapai sekitar Rp 50 juta. Dan menu tipat cantok Indomie yang paling banyak dipesan di warungnya, bisa mencapai sekitar 50-60 persen dibanding menu lain. Dalam sehari bisa habis lebih dari dua dus Indomie. Untuk rasanya sendiri terbilang unik, meskipun bumbu Indomie dicampur dengan bumbu kacang, tapi masih terasa bumbu mie di dalamnya. Lontongnya yang lembut sangat cocok dipadukan dengan tekstur mie yang kenyal dan sayuran yang segar. ""Untuk saat ini masih pakai Indomie saja, belum kepikiran pakai yang lain. Karena saya lihat penggemarnya sudah di mana-mana, rasanya juga melekat,"" ungkapnya. Made menjelaskan tipat cantok mi ada dua tipe, yakni goreng dan kuah. Warung Dot Lalah juga memiliki menu lain seperti tipat plecing Indomie, rujak kuah pindang, tipat kuah kare, dan masih banyak lagi. ",Food
"30 Tahun Beroperasi, Cafe Batavia Dijadikan Cagar Budaya DKI Jakarta","Senin, 04 Des 2023 11:30 WIB","Berdiri sejak 1805, Cafe Batavia menjadi daya tarik wisatawan luar dan lokal. Bahkan di usianya yang ke-30 tahun ini, kafe legendaris ini dijadikan cagar budaya. Cafe Batavia merupakan salah satu cafe legendaris yang bertempat di kawasan Kota Tua, Jakarta Utara. Cafenya berdiri tepat di seberang Museum Fatahilah. Bangunan ini sudah ada sejak 1805 sebagai tempat tinggal gubernur. Kemudian pada 1993 dialihfungsikan menjadi sebuah kafe dengan interior vintage zaman kolonial Belanda. SCROLL TO CONTINUE WITH CONTENT Tepat di hari jadinya pada Sabtu (02/12/23) Cafe Batavia genap sudah 30 tahun beroperasi. Puluhan tahun beroperasi, Cafe Batavia ditetapkan sebagai cagar budaya grade A, DKI Jakarta. Sejalan dengan fungsinya barunya Cafe Batavia ingin menghadirkan menu-menu menarik dengan sensasi bersantap yang unik. Tanpa menghilangkan akar sejarah dari bagunan legendaris ini. Dalam perayaan ke 30 tahun, Cafe Batavia menjamu para tamu dengan hidangan dengan gaya rijsttafel. Rijsttafel merupakan konsep penyajian makanan lengkap mulai dari pembuka hingga penutup. Dimulai dengan menu bitterballen sebagai menu pembuka. Padat dan creamy dengan rasa keju yang gurih. Kemudian, disajikan menu sup iga dengan kuah kaldu yang bening gurih. Untuk menu utama, ada nasi jeruk dengan berbagai lauk. Mulai dari rendang, ayam kodok, cumi bakar rica-rica, dan sayur urap. Semuanya disajikan secara rijsttafel dengan pramusaji yang kompak. Penyajian ayam kodok, salah satu hidangan kolonial yang masih populer juga menarik. Daging ayam tanpa tulang diisi dengan telur rebus. Disajikan dengan kentang dan sayuran. Lembut dan gurih rasanya. Tak ketinggalan menu bir pletok hingga cocktail yang disuguhkan untuk para tamu. Suasana bersantap ini juga diiringi dengan pertunjukan angklung dan jaipong. Cita rasa nusantara dengan pengalaman jamuan makan seperti di masa kolonial Belanda membuat nostalgia. Apalagi dengan suasana kafe yang dipenuhi dekorasi abad ke-19. Perayaan ulang tahun Cafe Batavia Ini juga dihadiri oleh para duta besar negara sahabat. Mulai dari kedutaan Rusia, Thailand, Austria, Australia, Amerika, Korea, Prancis dan masih banyak lagi. ",Food
Resep Oseng Petai dan Bawang Bombay yang Renyah Pedas Untuk Lauk Nasi,"Senin, 04 Des 2023 11:00 WIB","Petai selalu jadi lauk pembangkit selera makan. Apalagi dipadukan dengan bawang bombay yang renyah wangi dan cabe yang sedap menyengat. Meskipun aromanya kurang sedap tapi banyak orang menggemari petai karena rasa renyah segarnya. Selain dijadikan sambal goreng atau lalapan segar, petai juga enak ditumis dengan bawang. Bawang bombay yang renyah dan beraroma wangi bisa jadi paduan yang sedap. Ditambah csbe rawit dan terasi, semakin sedap. Tumisan ini gampang dibuat dan pastinya bakal bikin nambah nasi. Berikut resep selengkapnya. SCROLL TO CONTINUE WITH CONTENT Oseng petai yang renyah segar ini bisa bikin nambah nasi terus. 1. Pilih petai yang segar dan tak ada bagian yang busuk. Jika petai agak layu, rendam air dingin beberapa saat hingga segar. 2. Selain daging ayam bisa dipakai daging sapi atau udang cincang kasar. Pilih sesuai selera. ",Food
