Judul,Tanggal,Artikel,Category
Rayakan Natal dengan Menara Macaroon hingga BBQ Seru di Tengah Kota,"Rabu, 13 Des 2023 17:30 WIB","Penggemar kue yang manis dan menggemaskan jangan lupa mampir ke sini! Menara macaroon hingga barbeque di tengah kota bisa dinikmati di sini. Jelang perayaan Natal sudah waktunya mencari rekomendasi tempat makan yang istimewa bersama keluarga. Malam Natal harus dimeriahkan dengan istimewa dan makanan-makanan yang enak. Ada beberapa restoran di Jakarta yang menawarkan pengalaman makan malam saat Natal yang tak spesial. Signatures Restaurant di Hotel Indonesia Kempinski Jakarta menjadi salah satu restoran yang layak untuk disambangi. SCROLL TO CONTINUE WITH CONTENT Di sini ada banyak hidangan makanan khas Natal mulai dari yang klasik hingga kekinian. Berbagai menu makanan dari Indonesia, Jepang, hingga Western bisa dilahap sepuasnya. Ketika memasuki Signatures Restaurant, para tamu akan langsung disambut dengan susunan kue-kue yang dibentuk seperti taman dengan menara-menara tinggi. Macaroon yang berwarna-warni juga disusun dan siap diambil oleh para tamu yang datang. Bergeser sedikit, pada taman camilan yang manis ini kamu juga bisa menemukan chocolate fondue yang dilengkapi marshmallow hingga potongan buah-buahannya. Konsep yang cantik dan menggemaskan dijamin membuat anak-anak akan penasaran dan tak sabar untuk mencicipinya. Sebelum mulai melahap pilihan dessertnya yang cantik, jangan lupa untuk menyantap menu utamanya yang lezat-lezat. Smoked salmon sebagai menu khas Natal bisa disantap sambil memancing nafsu makan. Seafood yang segar hingga ayam kalkun panggang yang smokey tak oleh terlewat untuk dicicipi. Khusus perayaan Natal tahun ini Signatures Restaurant juga menghadirkan sensasi barbeque yang tak kalah seru. Baca juga: 5 Makanan Viral Sepanjang Tahun 2023, Sudah Pernah Cicip? Area outdoor restoran telah disiapkan dengan bahan-bahan seperti lamb chop, daging, ayam, ikan, udang, dan berbagai bahan lain untuk dibakar. Ada chef khusus yang akan melayani para tamu untuk membakar bahan makanan segar untuk disantap sebagai barbeque yang mantap. Seluruh hidangan yang disajikan untuk buffet spesial liburan ini diracik oleh chef-chef dari restoran yang handal dibidangnya. Ada OKU dengan menu khas Jepang yang unik, Paulaner yang memberikan sentuhan Bavaria, hingga Kempi Deli yang menyajikan makanan penutup yang manis dan cantik. Buffet khusus musim liburan tahun hari ini akan tersedia mulai dari 22 - 29 Desember 2023 di Sugantures Restaurant, Hotel Indonesia Kempinski Jakarta. Tak hanya sekadar makan tetapi ada paket lengkap termasuk menginap hingga voucher belanja yang bisa dimanfaatkan. Paket liburan eksklusif yang ditawarkan oleh Hotel Indonesia Kempinski Jakarta bisa dipesan mulai dari Rp 2.950.000 nett. Selain paket liburan, ada juga hampers spesial yang bisa menjadi ide untuk kiriman kepada orang-orang terkasih mulai dari Rp 699.000. ",Food
12 Rekomendasi All You Can Eat Paling Favorit & Worth It di Bogor!,"Rabu, 13 Des 2023 17:05 WIB","Kapan lagi bisa makan sepuasnya dengan biaya yang tetap? Untung saja sekarang sudah banyak bertebaran restoran All You Can Eat alias AYCE. Nah, kalau kamu berdomisili di Bogor dan mencari tempat makan di Bogor yang worth it, boleh banget mampir ke restoran All You Can Eat. Bagi warga Bogor yang cari tempat makan All You Can Eat (AYCE), kamu gak perlu bingung lagi. Ada banyak restoran All You Can Eat Bogor dengan segudang menu menarik yang bisa kamu kunjungi. Mulai dari yang terjangkau sampai yang bintang lima, semuanya ada di daftar ini! Cari All You Can Eat Di Aplikasi Food Discovery Horego SCROLL TO CONTINUE WITH CONTENT Untuk memilih tempat AYCE yang tepat dan menawarkan kualitas makanan yang oke, sekarang juga jadi lebih mudah dengan aplikasi Horego. Aplikasi direktori makanan ini membuat kamu semakin mudah mencari tempat makan terbaik dan mendapatkan review jujur dari penggunanya. Cara pakainya mudah, kamu bisa jalan-jalan kuliner Bogor dengan menulis area Bogor di bagian location. Jika lokasi sudah di area Bogor, tinggal cari nama restoran All You Can Eat terdekat Bogor yang mau kamu kunjungi. Kamu juga bisa menulis ""All You Can Eat"" di kolom search dan mendapatkan rekomendasi tempat makan AYCE terbaik di Bogor. Cek juga bagian review untuk membaca review jujur dari orang yang sudah pernah makan di restoran tersebut. Kamu juga bisa memberi review loh, seusai makan di tempat tertentu. Atau jika kamu masih mempunyai rencana makan beberapa hari lagi, kamu bisa buat Placelist yang terdiri dari beberapa rekomendasi tempat makan yang mau kamu tuju. Satu aplikasi, semua lengkap, untuk temani pencarian makanmu! 12 Restoran All You Can Eat Bogor Wajib Coba 1. GoGrill-ah! Butuh makan sepuasnya tapi budget hanya Rp100 ribu saja? Datang ke GoGrill-ah! Restoran All You Can Eat Bogor ini banyak dikunjungi karena harganya murah dan pilihan makanannya lengkap, mulai dari shabu-shabu sampai grill. Pilihan dagingnya beragam, ada slice dan saikoro. Yang pasti, teksturnya tebal dan empuk banget. Kamu juga bisa tambah menu lainnya, kayak kentang goreng, daging ayam, spaghetti, sampai beef burger. Lengkap deh! 2. Caddie Grill Tahu nggak sih, kalau restoran All You Can Eat Bogor ini ternyata dimulai dari gerobak telur gulung, lho! Pada tahun 2022, barulah Caddie Grill berubah menjadi restoran AYCE. Nah itu sebabnya, kamu nggak hanya menemukan daging untuk dipanggang, tapi ada juga menu telur gulung! Asyiknya lagi untuk orang lanjut usia (60 tahun ke atas), ada diskon sekitar Rp20.000 hanya dengan menunjukkan KTP! 3. Hanamasa Mau yang pasti-pasti saja saat mengunjungi AYCE Bogor, pasti pilihan kamu bakal jatuh ke Hanamasa. All You Can Eat Bogor ini berlokasi di dalam Amaris Hotel Pajajaran. Jadi, kamu perlu masuk ke dalam hotel dulu untuk makan di sana. Ada banyak pilihan menu di sini, mulai dari yakiniku, shabu-shabu, dan menu pelengkap lainnya. Buat rasa nggak perlu diragukan lagi, karena restoran ini sudah ada sejak bertahun-tahun. 4. Pochajjang Di sini, kamu bisa menemukan berbagai menu barbeque dengan banyak makanan pendamping, misalnya japchae dan chicken karaage. Paket yang ditawarkan di sini harganya relatif murah. Bahkan, kamu gak perlu merogoh kocek lebih dari Rp130.000 untuk bisa santap daging wagyu! Karena waktu makannya hanya 90 menit, bijaksana dalam mengambil makanan karena kalau tidak habis kamu akan kena denda. 5. Shuka Grill Restoran All You Can Eat Bogor selanjutnya adalah Shuka Grill, yang lokasinya di Tanah Sareal. Di sini, kamu bisa memilih macam-macam paket yang bisa disesuaikan dengan isi dompet! Untuk yang paling terjangkau, kamu bisa mencoba Paket Standar, yang isinya suki shabu, karubi, dori, dan dada ayam. 6. Bakso Neng Amor Restoran All You Can Eat biasanya nawarin shabu-shabu atau barbeque. Di Bogor, ternyata ada AYCE unik yang nawarin makan bakso sepuasnya. Nama tempatnya Bakso Neng Amor. Lokasinya juga dekat dengan stasiun Bogor loh! Selain terjangkau, kamu akan menemukan banyak pilihan. Selain bakso halus dan urat, kamu bisa ngambil tulang iga dan jenis bakso lain dengan isian yang lezat. Kamu juga bisa nikmatin mie ayam dan es campur di sini. 7. Kirai Dimsum & Kitchen Lagi cari restoran All You Can Eat Dimsum Bogor yang enak dan banyak pilihannya? Kunjungi aja Kirai Dimsum & Kitchen. Ada dua paket AYCE dimsum yang bisa kamu jajal di restoran ini, misalnya paket All You Can Eat Standard, yang include siomay ayam, siomay nori, siomay udang, siomay mozzarella, sampai siomay kepiting. 8. Sumeragi Kalau kamu sedang mencari restoran All You Can Eat Bogor yang pilihan sausnya nikmat tiada tara, coba datang ke Sumeragi di Bogor Utara aja. Di sini, ada banyak pilihan saus untuk menemani daging yang di-grill. Selain itu, pilihan sayurnya variatif dan segar. Ada juga sekitar 7-8 jenis bakso yang lezat. 9. Manse Korean Grill Restoran All You Can Eat ini juga punya cabang di mana-mana sehingga rasanya tak perlu diragukan. Di Bogor, lokasinya ada di Jl. Pajajaran No.50. Kalau kesini, kamu harus mencicipi berbagai macam daging dengan pilihan kuah kaldu dan tomyum. Untuk sayurnya, ada pilihan sawi putih, kangkung, dan jamur enoki. 10. Pachi Pachi Shabu & Grill Mau makan sepuasnya di Bogor dengan budget dibawah Rp100.000? Pachi Pachi Shabu & Grill jawabannya! Pilihan bumbu dan saus di sini unik-unik. Kamu bisa mencicipi nikmatnya daging dengan sambal matah, teriyaki, ataupun black pepper. Puas deh makan di sini. 11. Shabu Hachi Gak cuma di Jakarta, Shabu Hachi juga melebarkan sayapnya ke Bogor, lho. Restoran All You Can Eat terdekat di Pajajaran ini lokasinya gak jauh dari halte bus depan Nike Factory Store. Shabu Hachi termasuk gerai AYCE yang cukup berkualitas dengan luas tempat yang nyaman, pas buat makan keluarga. Apalagi kalau ada yang berulang tahun, pas banget makan di sini supaya dapat surprise dirayakan dengan lagu Selamat Ulang Tahun - Jamrud. 12. Oh My Grill Tanah Sareal memang jadi surganya pecinta AYCE di Bogor. Buktinya, ini adalah restoran makan sepuasnya keempat yang ada di sana. Kali ini, kamu bisa mengunjungi Oh My Grill. Keunggulan dari Oh My Grill adalah resep BBQ-nya dibuat dengan kombinasi dari 17 bumbu rahasia yang bikin banyak orang ketagihan. Berminat coba? Gimana? Menggugah selera banget kan menu-menu di restoran All You Can Eat Bogor? Udah gitu, harganya juga relatif terjangkau. Yuk, cobain bareng teman-teman dan orang terdekatmu! Kamu juga bisa cek rekomendasi All You Can Eat terdekat di kota lainnya seperti All You Can Eat Jakarta, All You Can Eat Bandung, atau All You Can Eat Tangerang hanya di aplikasi Horego! ",Food
Iseng! Pria Ini Masak Udang Mentah di Toilet Pesawat,"Rabu, 13 Des 2023 17:01 WIB","Aksi yang dilakukan pria ini saat di pesawat menarik perhatian. Ia mencoba masak udang mentah di toilet pesawat dengan cara seperti ini! Perjalanan menggunakan pesawat mungkin melelahkan. Oleh karena itu, penumpang pesawat kerap memilih untuk beristirahat saja atau menikmati hiburan film yang ditawarkan oleh sebagian maskapai penerbangan. Beberapa maskapai penerbangan juga kerap menawarkan makanan gratis yang bisa dinikmati penumpang. Jika memang tidak ada makanan gratis, pramugari pesawat akan menawarkan pembelian makanan secara terpisah. SCROLL TO CONTINUE WITH CONTENT Namun, sebagian besar penerbangan, terutama penerbangan jarak jauh menawarkan makanan ke penumpangnya. Karenanya, penumpang tidak perlu repot-repot mencari makanan. Jangan sampai karena tidak ada makanan jadi melakukan aksi aneh. Seorang TikToker dengan nama akun @barfly7777 sedang melakukan perjalanan menggunakan pesawat terbang. Tidak diketahui lokasi dan tujuan penerbangan Barfly. Terlepas dari itu, Barfly memang terkenal sebagai seorang TikToker yang suka memasak atau membuat makanan di toilet. Beberapa pengalamannya saat masak di toilet pun berhasil. Namun, siapa sangka kali ini pria itu mencoba memasak makanan tetapi di tempat yang tidak terduga. Ketika sedang melakukan perjalanan pesawat ini, ia malah masak di toilet! Dalam unggahan videonya, pria ini menjelaskan dia akan memasak udang mentah dengan memanfaatkan alat 2 baterai 6V yang dihubungkan ke pemanas dan alat itu dicelupkan ke dalam air. Menurutnya, pemanas ini bisa dimanfaatkan untuk memasak udang. Pria ini pun sepertinya sudah membawa semua bahan-bahan dari rumah. Ia menunjukkan udang mentah serta bawang putih yang ia bawa. Barfly menunjukkan proses pembuatan udang tersebut. Diawali dengan menghidupkan dan menyambungkan baterai. Kemudian dia mengumpulkan air di wastafel. Barulah udang mentah dimasukkan untuk direbus beberapa menit. Ditambah dengan bumbu instan agar ada sedikit rasa. Barfly juga menambahkan mentega bawang putih agar rasanya lebih baik, lapor nypost.com (08/12). Setelah udang matang, ia mencampurkannya ke bubuk bawang putih, lalu memasukkannya ke kantong. Barfly pun balik ke kursinya dan menikmati udang yang ia masak di toilet pesawat itu. Unggahannya pun menarik perhatian banyak orang. Netizen terlihat terpesona dengan aksi tersebut. Banyak juga netizen yang tidak percaya dengan aksi yang dianggap konyol itu. Seorang netizen berkomentar, ""Tidak, dia tidak melakukannya."" Netizen lain yang terkejut menulis komentar, ""Ini adalah salah satu video paling gila yang pernah saya lihat di aplikasi ini."" Banyak juga yang mengomentari masalah kebersihan dan kekhawatiran mereka dengan nasib Barfly. Netizen takut aksi yang dilakukan Barfly justru membuatnya masuk ke dalam daftar orang terlarang. Sebagian orang juga penasaran mengapa Barfly bisa lolos dengan baterai 6 volt dan bahan-bahan makanan yang ia bawa. Menurut laporan nypost.com, semua barang yang dibawa oleh Barfly diperbolehkan untuk dibawa di bagasi atau bagasi kabin. Syaratnya, disetujui oleh maskapai penerbangan sesuai dengan peraturan yang ditetapkan Federal Aviation Administration. Namun, penumpang harus memastikan setiap komponen, seperti misalnya baterai, sekring, dan elemen panas terisolasi untuk mencegah aktivasi yang tidak disengaja.  ",Food
Ngakak! Pria Ini Pernah Rebutan Bihun Goreng sama Bunga Citra Lestari,"Rabu, 13 Des 2023 15:30 WIB","Pria ini punya pengalaman kocak saat makan di restoran yang sama dengan Bunga Citra Lestari. Mereka berdua berebut menu japchae. Begini ceritanya! Bertemu dengan publik figur secara tak sengaja mungkin sudah menjadi hal yang biasa. Momen tersebut biasanya berakhir dengan menyapa atau berfoto bersama. Namun, pria yang satu ini punya pengalaman kocak saat bertemu dengan penyanyi terkenal Bunga Citra Lestari (BCL) saat makan di satu restoran yang sama. SCROLL TO CONTINUE WITH CONTENT Cerita kocak tersebut viral usai dibagikan lewat thread di X oleh akun @jauntyallegory, pemilik brand parfum @multitude.scents (03/12/23). Ia mengatakan bahwa dirinya pernah rebutan menu japchae dengan BCL. Kepada detikcom (13/12/23), pemilik akun tersebut mengatakan bahwa kejadian itu terjadi di sebuah restoran Korea yang berada di kawasan Dharmawangsa, Jakarta Selatan pada 25 Maret 2023 lalu. ""Lagi makan di restoran Korea kecil gitu, dia (BCL) sama suaminya yang sekarang ini dan keluarganya, sepertinya ada acara ulang tahun,"" ujarnya. Saat itu, pria tersebut memesan menu japchae, kuliner khas Korea yang seperti bihun goreng. Kemudian, saat pesanan japchae-nya datang lebih dulu, BCL merasa heran. ""Terus pas japchae-nya datang, dia tiba-tiba ngomong agak keras, 'Mbak kok mereka duluan sih?',"". Dan pertanyaan tersebut dilontarkan oleh istri Tiko Aryawardhana secara berulang-ulang. Lebih lanjut, pemilik akun tersebut menceritakan bahwa restoran Korea yang disinggahinya itu ruangannya kecil. Hanya ada 6-8 meja dengan jarak yang berdekatan. ""Dia berdiri melototin Japchae kami sambil jelasin kalau rombongan dia tuh udah kelar makan, masa japchaenya gak dateng-dateng,"" lanjutnya. ""Rasanya pengen kasih tu bihun tapi udah masuk ke mulut 2 suap. Bayangin ada kali 5-15 menit harus makan japchae sambil dipelototin BCL,"" tambahnya dengan nada canda. Kejadian tersebut juga dibenarkan oleh pemilik akun @jowiwi26 yang saat itu berada di restoran yang sama. ""Waktu kejadian ini, aku juga ada di tempat, dan sebenarnya waktu Kak Unge marah-marah, itu bihun japchae nya udah mulai kita makan sambil lirik kecil ke meja beliau,"" ujarnya. Pemilik akun @jauntyallegory menegaskan bahwa dari kejadian ini ia tak bermaksud untuk menggiring opini ke hal yang negatif. Hanya saja ingin menceritakan pengalaman kocak yang dialaminya. Komentar lucu pun memenuhi cuitan mereka. ""Ya Allah lucu banget. Tapi kebayang awkwardnya. tapi lucu,"" tulis netizen. ""Menghibur banget mas pengalamannya, cocok dibaca pas lagi rebahan kayak gini,"" tulis netizen lainnya.  ",Food
"5 Makanan Viral Sepanjang Tahun 2023, Sudah Pernah Cicip?","Rabu, 13 Des 2023 15:00 WIB","Selama tahun 2023 banyak makanan viral mulai dari yang pedas hingga manis. Diantara sekian banyaknya, mana yang pernah kamu cicipi? Hiruk pikuk tahun 2023 seolah menyambut kembali kehidupan yang berangsur normal. Setelah lepas dari pandemi, tahun 2023 menjadi titik balik semua sektor hampir pulih dan aktivitas masyarakat semakin padat. Termasuk perkembangan tren kuliner yang sepanjang tahun diramaikan oleh makanan-makanan viral di media sosial. Makanan yang unik, masuknya makanan dari luar negeri ke Indonesia, hingga pengaruh para konten kreator yang mempepopulerkan makanan-makanan tertentu menjadi alasan utamanya. SCROLL TO CONTINUE WITH CONTENT Setidaknya ada beberapa yang tercatat oleh detikfood sebagai makanan-makanan viral selama 2023. Mulai dari yang rasanya pedas menyengat hingga manis legit ada semua. Detikers sudah cicip yang mana? Dipopulerkan oleh member SM*SH, Rafael Tan, seblak yang terkenal sebagai camilan khas tanah Sunda mendadak viral. Berbeda dengan seblak berkuah, Rafael Tan memperkenalkan seblak cobek dengan sambal ulek yang dibuatnya sendiri di rumah. Video pertama dirinya menyantap seblak dilihat hingga 5,3 juta kali oleh netizen. Sejak video pertamanya itu banyak netizen yang mencoba untuk membuat seblak ala Rafael sendiri di rumah. Bahkan penyanyi sekaligus aktor tersebut sampai dinobatkan menjadi duta seblak. Racikan cikur atau kencur, cabai rawit, dengan kerupuk yang telah direbus hingga kini masih diminati. Berawal dari gurauan April Mop, sebuah produsen es krim dikira hanya mengecoh netizen. Es krim cone dengan rasa Indomie sempat tak banyak dipercaya dan hanya dianggap sebagai tipuan belaka. Ternyata pihak Indoeskrim selaku produsen es krim tersebut mengonfirmasi kebenaran akan produk yang diproduksinya. Sontak netizen di media sosial seolah berlomba-lomba untuk mendapatkan es krim tersebut. Ketika detikfood berusaha mendapatkannya untuk ikut mencicipi, kami sempat kesulitan mencari produk tersebut karena habis di hampir semua minimarket. Setelah mendapatkannya, kami membuktikan aroma Indomie yang kuat benar-benar tercium dari es krimnya. ",Food
"Kisah Jamu Gendong, dari Minuman Kerajaan hingga Tercatat di Relief Candi","Rabu, 13 Des 2023 14:30 WIB","Jamu gendong merupakan minuman tradisional yang masih eksis sampai sekarang. Sejarah jamu gendong panjang karena berawal dari masa kerajaan Hindu-Buddha. Jamu gendong merujuk pada minuman jamu yang dijajakan di bakul dengan cara digendong. Penjual jamu gendong akan berkeliling menawarkan minuman ini. Dahulu mereka biasanya berjalan kaki, tapi sekarang ada yang menggunakan sepeda hingga gerobak. Jamu gendong pun masih relatif mudah ditemui sampai saat ini. SCROLL TO CONTINUE WITH CONTENT Menilik sejarahnya, mengutip buku Jamu Gendong Solusi Sehat Tanpa Obat terbitan Badan Pengembangan dan Pembinaan Bahasa, tradisi meramu dan mengonsumsi jamu diyakini sudah ada sejak berabad-abad yang lalu. Proses meracik jamu telah menjadi budaya pada masa kekuasaan kerajaan Hindu dan Buddha. Bukti dari keberadaan tradisi ini tergambar dalam relief-relief yang menggambarkan pembuatan dan penggunaan jamu pada beberapa candi terkenal di Indonesia, termasuk Candi Borobudur, Candi Prambanan, Candi Penataran, Candi Sukuh, dan Candi Tegalwangi. Selain ada dalam relief candi, sejarah jamu gendong juga tertulis dalam Serat Centhini (1814 M) dan Kawruh Bab Jampi-Jampi Jawi (1858 M) yang berisi 1.734 resep ramuan jamu. Kawruh Bab Jampi-Jampi Jawi mungkin menjadi buku terlengkap yang berisi tentang jamu. Tercatat dalam sejarah, budaya meracik jamu mulanya hanya dikenal di lingkungan istana, di mana jamu diracik khusus untuk para raja, permaisuri, pangeran, dan putri keraton semata. Keluarga kerajaan menggunakan jamu sebagai upaya menjaga kesehatan, kebugaran, dan kecantikan. Namun, seiring berjalannya waktu, budaya meracik jamu mulai diperkenalkan kepada masyarakat umum oleh orang-orang dari kalangan keraton. Proses ini diperkirakan dimulai pada akhir periode Kerajaan Majapahit dan berlanjut pada masa kerajaan-kerajaan berikutnya, termasuk Kesultanan Yogyakarta dan Kasunanan Surakarta. Jamu dulunya hanya diracik oleh orang yang dianggap memiliki kekuatan spiritual, seperti wiku atau dukun. Penjualan jamu dengan cara digendong diyakini dimulai pada masa Kerajaan Mataram Islam, di mana praktik pengobatan oleh para wiku melibatkan ramuan jamu dan doa-doa. Para wiku kemudian mengirimkan jamu racikannya kepada orang-orang yang membutuhkan atau sesuai dengan pesanan dengan menggunakan utusan laki-laki untuk pengiriman. Seiring naiknya permintaan terhadap jamu, praktik pengiriman dan penjualan jamu ke berbagai tempat menjadi lebih teratur. Jamu semakin banyak dijual secara berkeliling oleh pedagang laki-laki dan perempuan. Resep pembuatan jamu gendong pun tersebar lebih luas. Meskipun awalnya banyak dilakukan oleh laki-laki, lambat laun pekerjaan ini menjadi didominasi kaum perempuan karena dianggap lebih sesuai dengan sifat keluwesan dan keramahan mereka, sementara tenaga laki-laki lebih diperlukan dalam usaha pertanian. Situasi ini pun berlanjut hingga era modern saat ini. Saat ini, ada lebih banyak penjual jamu gendong yang telah mengadopsi metode penjualan yang lebih modern, yakni dengan menggunakan sepeda atau gerobak dorong dan tidak mengandalkan berjalan kaki. Meski cara penjualannya berubah, jenis jamu yang ditawarkan tetap sama dengan yang dijajakan secara tradisional dengan cara digendong Pada masa Kerajaan Majapahit, jamu menjadi minuman istimewa yang disajikan pada upacara-upacara kerajaan bagi raja dan keluarganya. Ada delapan jenis jamu yang dikonsumsi oleh raja dan putra-putri keraton. Jenis-jenis jamu tersebut melibatkan kunyit asam, beras kencur, cabe puyang, pahitan, kunci suruh, kudu laos, uyup-uyup, gepyokan, dan sinom. Keseluruhan jamu ini memiliki manfaat untuk menjaga kebugaran, merawat kecantikan, serta melambangkan delapan arah mata angin dan simbol Surya Majapahit. Ahli arkeologi menduga bahwa Surya Majapahit berperan sebagai lambang negara Majapahit Rasa dari kedelapan jamu ini mengikuti urutan mulai dari manis-asam, sedikit pedas-hangat, pedas, pahit, tawar, hingga kembali manis. Urutan rasa ini menggambarkan siklus kehidupan manusia. Artikel ini ditulis oleh Jihan Nisrina Khairani Peserta Program Magang Bersertifikat Kampus Merdeka di detikcom. Artikel ini sudah tayang di detikjogja dengan judul Sejarah dan Filosofi Jamu Gendong, Warisan Nenek Moyang Masa Hindu-Buddha ",Food
Begini Lezatnya Tahu Pong Semarang Favorit Orang Terkaya di Indonesia,"Rabu, 13 Des 2023 14:00 WIB","Meskipun sederhana, hanya berupa tahu goreng dan saus kecap petis, tetapi kuliner khas Semarang ini jadi favorit banyak orang. Termasuk orang terkaya di Indonesia. Siapa sangka bahwa sosok bos Djarum dan BCA Bambang Hartono, salah satu orang terkaya di Indoensia merupakan pelanggan warung tahu pong di Semarang. Nama warungnya,Tahu Pong Karangsaru. Hal tersebut pernah diungkap oleh seorang pengguna X @ayudh68 pada 2019 lalu. Ia memotret sosok orang terkaya di Indonesia tersebut sedang menikmati tahu pong di warung langsung. ""Beliau, pelanggan setia Tahu Pong Karangsaru Semarang. Terima kasih kasih Om Hwi Siang (Michael Bambang Hartono), Big Boss Djarum dan BCA,"" bunyi cuitannya di X. SCROLL TO CONTINUE WITH CONTENT Selain Bambang Hartono, banyak orang mengakui kelezatan Tahu Pong Karangsaru. DetikFood pun tak mau ketinggalan untuk membuktikan kelezatannya. Warungnya ini berlokasi di Jalan Pringgading nomor 11 D, Brumbungan. Kami memesan paket komplet (Rp 37.000) yang isiannya terdiri dari, tahu pong, tahu emplek, telur ayam, gimbal udang. Porsinya banyak, bahkan sampai menggunung. Semua isian tadi digoreng garing. Kemudian disajikan dengan acar lobak dan saus cocolan yang terbuat dari campuran petis dan kecap manis. Rasa gurih terasa kuat pada semua isian paket kompletnya. Mulai dari tahu pong dengan isian kopong yang renyah, tahu emplek yang perpaduan renyah di luar dan lembut pada isiannya. Ditambah lagi dengan gimbal udang dan telur ayam rebus goreng yang menambah tekstur tersendiri. Cita rasanya semakin kaya saat dicocol dengan saus petis yang cenderung manis dan acar lobak yang asam renyah. Atau bisa ditambah sambal ijo yang tersedia di sana untuk menambah rasa pedas. Jadi, dalam sekali suap kamu bisa menikmati banyak rasa. ",Food
