Judul,Tanggal,Artikel,Category
7 Jenis Rebusan Daun Untuk Menurunkan Kolesterol Tinggi,"Sabtu, 09 Des 2023 16:00 WIB","Kadar kolesterol yang tinggi dapat mengakibatkan masalah yang serius bagi kesehatan. Misalnya gangguan pada pembuluh darah yang akhirnya memengaruhi sirkulasi, kerja jantung, dan organ lainnya. Karena itu, kadar kolesterol yang terlalu tinggi harus diturunkan hingga level normal. Baik dengan obat-obatan maupun konsumsi herbal, misalnya rebusan daun. Berikut ini beberapa rebusan daun untuk menurunkan kadar kolesterol dalam tubuh: SCROLL TO CONTINUE WITH CONTENT Dikutip dari tulisan berjudul Pengaruh Pemberian Rebusan Daun Alpukat Terhadap Penurunan Kadar Kolesterol di Desa Dukuhklopo Kecamatan Kabupaten Jombang yang ditulis oleh Siti Rohmani dan Elly Rustanti, daun alpukat mengandung senyawa flavonoid yang tinggi salah satunya adalah senyawa kuersetin. Flavanoid berfungsi mengurangi kadar kolesterol dalam darah. Hal ini terjadi karena senyawa ini dapat menghambat oksidasi agar tidak terjadi kerusakan lipid serta terbentuknya sel busa. Dalam tulisan berjudul Kandungan Antioksidan pada Daun Kelor (Moringa oleifera) dan Potensi Sebagai Penurun Kadar Kolesterol Darah yang ditulis oleh Angelyn Tjong, dkk, daun kelor mengandung antioksidan yang bermanfaat menurunkan kadar kolesterol dengan menurunkan konsentrasi LDL. Daun kelor juga memiliki manfaat lain karena memiliki banyak kandungan nutrisi. Misalnya vitamin A, vitamin B1, B2, B3, vitamin C, dan masih banyak lagi. Tulisan dalam Jurnal Multidisiplin Dehasen (MUDE) berjudul Efektivitas Pemberian Rebusan Daun Salam Terhadap Kolesterol Total Dengan Hiperkolesterolemia Di Wilayah Kerja Puskesmas Desa Gedang Kota Sungai Penuh Provinsi Jambi Tahun 2022 oleh Emilia menjelaskan, rebusan daun salam dapat menurunkan kadar kolesterol. Air rebusan daun salam mengandung senyawa eugenil, metil kavikol siral, antijamur, antibakteri, flavonoid, tanin vitamin A, B kompleks C, dan minyak atsiri yang berperan menghambat oksidasi LDL. Konsumsi air rebusan daun sirsak dapat menurunkan kadar kolesterol, seperti dijelaskan dalam tulisan berjudul Pengaruh Rebusan Daun Sirsak Terhadap Penurunan Kadar Kolesterol di Kelurahan Nanga Bulik Kecamatan Bulik Kabupaten Lamandau oleh Iswadi, dkk. Senyawa aktif flavonoid dalam air rebusan dapat menurunkan kadar kolesterol darah dengan cara meningkatkan ekskresi asam empedu. Manfaat flavanoid lainnya adalah mengurangi kekentalan darah sehingga mengurangi terjadinya pengendapan lemak. Dikutip dari Perpustakaan Poltekkes Malang, air rebusan daun kari memiliki manfaat untuk menurunkan kolesterol. Tak hanya menurunkan kolesterol saja, air rebusan daun kari juga memiliki banyak manfaat. Mulai digunakan untuk mengatasi anemia, mengobati diare, dan mengatasi diabetes. Situs Medical News Today menjelaskan, serai dapat digunakan untuk mengobati kolesterol tinggi. Pada artikel dalam Journal of Advanced Pharmaceutical Technology & Research dijelaskan, mengonsumsi ekstrak serai dapat menurunkan kolesterol pada hewan. Dikutip dari laman Direktorat Jenderal Pendidikan Vokasi Kemendikbud, daun afrika telah digunakan secara tradisional untuk pengobatan beberapa kondisi kesehatan. Daun afrika memiliki kandungan senyawa bioaktif, seperti polifenol, flavonoid, dan saponin. Beberapa penelitian menunjukkan, senyawa tersebut dapat menurunkan kadar kolesterol total dan LDL dalam darah. Jika rebusan daun belum bisa menurunkan kadar kolesterol, jangan segan segera menghubungi dokter. Level kolesterol dalam darah yang terlalu tinggi harus diturunkan, dengan obat-obatan sesuai resep dokter. ",Food
"Imbas Kontroversi MCI Season 11, Masakan Chef Renatta Jadi Sorotan","Sabtu, 09 Des 2023 15:00 WIB","Chef Renatta baru saja mengunggah foto makanan dari menu plant based yang ia masak. Bukan mendapatkan pujian, netizen justru menyebut masakannya mirip sesajen. Chef Renatta Moeloek kerap mencuri perhatian setelah tampil sebagai juri dalam program kompetisi memasak MasterChef Indonesia. Chef yang juga memiliki beberapa bisnis restoran ini diketahui aktif di media sosial. Belum lama ini chef Renatta mengunggah foto hasil masakannya ke Instagram (7/12). Ia menuliskan keterangan dalam bahasa Inggris yang berarti, ""Sayuran.. sayuran yang cantik."" SCROLL TO CONTINUE WITH CONTENT Makanan yang ia buat itu terdiri dari aneka sayuran. Hidangan ini kerap disebut sebagai menu plant based. Chef Renatta tampak menyajikan sayuran di atas piring besar berwarna merah, lengkap dengan tahu goreng, irisan mentimun, jeruk nipis, dan saus dressing. Tampilan penyajian makanan ini memang terlihat menumpuk. Unggahan masakan buatan chef Renatta ini langsung mencuri perhatian netizen. Jika biasanya chef Renatta banyak mendapat pujian netizen, kini sebaliknya. Dikarenakan imbas pro kontra penobatan juara MasterChef Indonesia Season 11. Banyak netizen yang mengomentari soal penyajian makanan yang dibuat oleh chef Renatta itu. Beberapa netizen mengatakan kalau penyajian atau platting itu sangat berantakan. Terlihat juga beberapa komentar pedas yang dilontarkan oleh netizen. Seperti tumpukan sampah, kuburan baru, hingga sesajen. ""Kayak tumpukkan sampah,"" komentar netizen. ""Kalau menurutku ini amburadul chef,"" sahut netizen lain. ""Mirip sesajen,"" komentar lainnya. Saat ini detikFood telah berusaha menghubungi chef Renatta Moeloek untuk meminta tanggapannya. Namun, sampai saat ini belum mendapatkan balasan. ",Food
7 Hal Terbaik yang Bisa Dilakukan Usai Kebanyakan Makan,"Sabtu, 09 Des 2023 13:00 WIB","Usai kalap kebanyakan makan, kamu tak perlu meratapi nasib jumlah kalori yang sudah terlanjur masuk. Alih-alih berdiam diri dan menyesal, coba lakukan 7 hal ini. Dalam beberapa kesempatan, kamu mungkin berakhir makan terlalu banyak. Contohnya ketika makan bersama keluarga atau saat sedang menghadiri jamuan makan besar. Tak perlu menyesal dengan yang sudah terjadi, beberapa hal bisa dilakukan usai kebanyakan makan. Kamu bisa memulihkan rasa begah sekaligus kembali menyehatkan pencernaan. SCROLL TO CONTINUE WITH CONTENT Mengutip Eat This, Not That! (24/11/2023), inilah 7 hal terbaik yang bisa dilakukan usai kebanyakan makan menurut ahli gizi: Setelah makan banyak, kamu mungkin mengalami sembelit atau rasa tak nyaman pada perut, terutama ketika menyantap makanan rendah serat. Untuk memulihkan kondisi ini, perbanyak asupan serat keesokan harinya. Ahli gizi Amy Goodson mengatakan, ""Asupan serat tidak larut menambah jumlah besar pada tinja, melancarkan buang air besar secara teratur, dan mencegah sembelit."" Ia menyarankan konsumsi oatmeal atau roti gandum dengan alpukat saat sarapan keesokan hari usai makan banyak. Ahli gizi Tammy Lakatos dan Lyssie Lakatos menambahkan kalau kamu perlu makan cukup sayuran usai makan banyak agar tubuh merasa lebih baik. Serat pada sayuran bantu mendorong limbah dan racun dari usus sehingga kamu merasa lebih 'enteng'. Sayuran yang direkomendasikan adalah jenis sayuran hijau. Jenis sayuran ini tak hanya kaya serat, tapi juga tinggi antioksidan yang bisa melawan beberapa kerusakan akibat terlalu banyak mengonsumsi makanan bergula, berlemak, dan diproses secara berlebihan. Selain mencukupi kebutuhan serat dan sayuran, kamu bisa sarapan bergizi seimbang keesokan harinya usai makan banyak. Kombinasikan sumber protein dan serat agar kadar gula darah sehat. Goodson mengatakan, ""Telur dan oatmeal atau roti gandum panggang dengan selai kacang bisa jadi pilihan. Jangan lupa pendamping Greek yogurt."" Melahap sarapan bergizi seimbang bisa membuat kamu merasa lebih baik usai makan banyak. Jika masih ada makanan sisa pesta atau jamuan sebelumnya, hindari konsumsi makanan tersebut. Biasanya makanan itu tinggi kalori yang justru tidak memulihkan rasa tidak nyaman usai makan banyak. Lebih baik fokus pada konsumsi makanan sehat keesokan harinya. Perbanyak konsumsi makanan utuh yang tinggi serat dan tinggi protein. ",Food
Di Bar Mewah Ini Bisa Nikmati 12 Cocktail dengan Panorama Cantik Jakarta,"Sabtu, 09 Des 2023 11:00 WIB","Terletak di lantai atas hotel bintang lima di Jakarta. Bar mewah ini tawarkan aneka racikan cocktail terbaik dari mixologist. The Langham Jakarta mempwrkenalkan bar mewah bernama Artesian Bar. Artesian Bar merupakan bar dari The Langham, London yang memenangkan penghargaan bar terbaik di dunia sebanyak empat kali. Bar inilah yang kemudian dibawa ke Jakarta dan menjadi Artesian Bar pertama di Asia Tenggara. Terletak di lantai 65 The Langham, Jakarta dan dibuka pada tanggal 8 Desember 2023. SCROLL TO CONTINUE WITH CONTENT Berbeda dengan bar lainnya, Artesian Bar menawarkan konsep yang baru yaitu 'Garden of Eden'. Interiornya yang mewah seakan membawa setiap pengunjung untuk masuk ke tempat fantasi dengan pemandangan kota Jakarta yang cantik. Bar ini terdiri dari dua area, ada area rooftop bar dengan konsep outdoor yang dipenuhi tanaman hijau. Lalu ada lounge indoor yang menghadap ke jalanan SCBD. Untuk menu minumannya, Artesian Bar menawarkan 12 Signature Cocktails yang merupakan hasil kolaborasi bersama The Cocktail Professors. Setiap cocktail di Artesian Bar terinspirasi dari interpretasi akan kehidupan. Seperti cocktail 'Divine', diracik dengan Tennessee Whiskey, Tequila lalu diberi sentuhan unik dari kelapa, madu dan garam Himalaya. Rasanya manis dan ada sedikit sentuhan kelapa di cocktail ini. Bagi penggemar kopi, wajib mencoba cocktail 'Pure' yang merupakan paduan dari Scotch dan kopi Luwak. Rasa kopinya yang dominan menambah cita rasa unik dari cocktail yang satu ini. Lalu untuk menu cocktail yang segar ada 'Passion', diracik dari Gin dan Maraschino Liqueur, kemudian dicampur dengan buah naga, citruss serta kunyit. Selain cocktail, Artesian Bar juga memiliki menu Signature Mocktail tanpa racikan alkohol yang tak kalah menarik. Seperti 'Virgin Envy' yang diolah dari nanas, susu beras dan kacang tonka yang terkenal dengan rasa manisnya. Karena konsep Artesian Bar fokus di cocktail dan racikan minuman, makanan yang ditawarkan berupa tapas atau hidangan pendamping yang sudah disesuaikan dengan menu minuman. Seperti keripik kulit ikan dengan bumbu telur asin, kemudian ada mini burger dari daging wagyu dan foie gras. Sampai menu cake untuk dessert seperti Black Sesame Cake dan Chocolate Orange. Kisaran harga cocktail dan makanan di sini mulai dari Rp 150.000++. Bagi yang ingin berkunjung ke Artesian Bar, bar ini buka setiap hari Rabu - Minggu dari jam 17.00 - 00.00. Untuk informasi lebih lanjut dan reservasi bisa cek Instagram @langham_jakarta dan @artesianbarjakarta. ",Food
"Wasabi Jadi Pelengkap Wajib Sushi, Ini 5 Manfaat Sehatnya","Sabtu, 09 Des 2023 09:00 WIB","Wasabi kerap jadi pelengkap sushi yang rasa pedasnya unik. Sensasi bisa menyengat hingga hidung dan kepala. Ternyata wasabi menyimpan manfaat sehat. Wasabi merupakan pasta berwarna hijau yang biasanya disajikan sebagai pelengkap sushi. Pasta ini bercita rasa pedas dan menyengat. Oleh karenanya, tak semua orang menyukai wasabi ini. Dilansir dari WebMD (22/11), pasta hijau yang terbuat dari tanaman atau rimpang bernama wasabi ini aslinya hanya diparut. Harga wasabi juga terbilang mahal, karena tanamannya cukup sukit ditanam. SCROLL TO CONTINUE WITH CONTENT Sebagian besar wasabi yang disajikan di restoran-restoran sushi tidak lagi mengandung wasabi asli. Sebaliknya, wasabi itu justru terbuat dari lobak pedas, tepung mustard, maizena, dan pewarna hijau untuk menghadirkan tampilan wasabi asli. Tak hanya memberikan cita rasa pada masakan, tapi wasabi asli juga menyimpan manfaat yang menyehatkan. Dalam 1 sendok teh (6,5 gram) wasabi mengandung 15 kkal, 1 gram lemak, 2 gram karbohidrat, dan 2 gram gula. Kandungan lainnya ada zat besi, magnesium, fosfor, potasium, dan sodium. Meski kandungan nutrisinya tak begitu tinggi, tapi sering disajikan bersama hidangan bergizi yang berbahan dasar ikan. Wasabi diketahui mengandung zat besi yang memberikan manfaat jika dikonsumsi. Bagi penderita anemia, wasabi ini bisa menurunkan risiko terkena anemia. Anemia sendiri adalah kondisi yang menyebabkan gejala seperti kelelahan, jantung berdebar, dan masalah lain yang berkaitan dengan kadar zat besi dalam darah. Zat besi ini bisa berdampak pada tingkat hemoglobin dalam darah yang bisa mengantarkan oksigen ke seluruh tubuh. ",Food
5 Makanan yang Bikin Kualitas Sperma Meningkat dan Banyak,"Sabtu, 09 Des 2023 08:00 WIB","Kualitas dan kuantitas sperma merupakan faktor yang menentukan kesuburan seorang pria. Sperma yang berkualitas adalah sperma yang jumlah produksinya banyak dengan motilitas yang tinggi. Dengan begitu, kemungkinan kehamilan akan lebih mudah dihasilkan. Lalu, konsumsi apa biar sperma tambah banyak? Simak jawabannya di bawah ini. Salah satu cara meningkatkan kualitas sperma adalah dengan mengkonsumsi bahan makanan yang kaya seng, vitamin B12, dan senyawa antioksidan. SCROLL TO CONTINUE WITH CONTENT Dilansir dari laman CNY Fertility, berikut adalah makanan yang bisa dikonsumsi untuk meningkatkan kualitas sperma dan memperbanyaknya: Salmon adalah ikan dengan kandungan asam lemak omega-3 tinggi. Kandungan tersebut bermanfaat untuk kesehatan, termasuk meningkatkan jumlah sperma. Mengkonsumsi omega-3 pada salmon, membantu dalam membentuk struktur dan sel sperma. Selain itu, ikan ini juga kaya akan vitamin B12 arginin dan asam aspartat. Kandungan dalam salmon tersebut telah terbukti mampu untuk meningkatkan jumlah dan motilitas sperma. Selain ikan salmon, pilihan ikan yang bisa untuk menambah jumlah sperma itu juga bisa didapat dari ikan sarden. Daging sapi memiliki kandungan seng tinggi, yang bisa memperbanyak sperma yang sehat dan motilitasnya. Dalam sebuah penelitian, para peneliti mengungkapkan bahwa seng bisa memperbaiki masalah kesuburan pada pria. Kandungan Acetyl L-Carnitine (ALC) yang dikenal sebagai karnitin dalam daging sapi juga dianggap paling efektif dalam meningkatkan motilitas sperma. Selain terkenal mampu meningkatkan gairah seksual, tiram juga bagus untuk meningkatkan produksi sperma pada pria. Tiram mengandung vitamin B12, vitamin C dan selenium, yang berguna dalam meningkatkan jumlah dan motilitas sperma.Dalam hal ini, kandungan vitamin B12 tiram berperan penting dalam perkembangan sperma, khususnya sintesis DNA. Tomat banyak mengandung vitamin C dan likopen (zat pemberi warna merah pada tomat). Likopen ini berperan sebagai antioksidan kuat, yang memberi efek positif pada kesuburan pria. Dalam sebuah penelitian, orang yang mengkonsumsi likopen sebanyak 4 miligram setiap hari akan meningkatkan jumlah sperma dan motilitasnya sebesar 25%. Bawang putih memiliki senyawa antioksidan yang sangat bermanfaat pada kesuburan pria. Oleh karena itu, konsumsi bawang putih bisa membuat sperma banyak dengan kadar testosteron yang tinggi. Selain itu, bawang putih juga bisa melindungi kerusakan produksi sperma serta kadar testosteron yang disebabkan perawatan kemoterapi. ",Food
3 Resep Ikan Kuah Asam Segar yang Lezat Meresep Bumbunya,"Sabtu, 09 Des 2023 07:00 WIB","Selain digoreng, ikan juga enak dimasak dengan kuah asam. Ikan tenggiri, ikan gabus hingga ikan kakap makin sedap menyegarkan rasanya. Jenis ikan laut berdaging tebal dan gurih seperti ikan kakap dan ikan tenggiri, enak dimasak dengan kuah asam segar. Air jeruk nipis dan asam Jawa memberi rasa kecut dan menghilangkan aroma anyir. Selain itu ikan air tawar seperti gabus juga enak dimasak dengan kuah asam Jawa yang menyegarkan. Tambahan cabe selalu membuat olahan ikan semakin lezat dinikmati. SCROLL TO CONTINUE WITH CONTENT Gunakan ikan segar agar dagingnya tak gampang hancur dan aromanya tidak anyir. Tiga resep ikan kuah asam ini bisa jadi pilihan enak untuk makan siang. Pedas asam menyegarkan Gurih padat daging ikan kakap makin enak dimasak dengan kuah asam segar. Cocok untuk menu makan siang. ",Food
"5 Makanan yang Bikin Stress Tambah Parah, Batasi Konsumsinya","Sabtu, 09 Des 2023 06:00 WIB","Tidak semua makanan menjadi solusi untuk menghilangkan stress. Pasalnya, ada sejumlah makanan yang justru membuat atau memperparah stress yang dialami, seperti 5 makanan ini. Banyak orang berpikir stress bisa hilang dengan cara mengonsumsi makanan apa saja yang diinginkan. Mungkin itu benar adanya, tetapi tidak semuanya. Sebab, ada sejumlah makanan yang justru bisa menyebabkan stress atau memperparah stress. Ketika terus menerus stress, tubuh tetap berada dalam mode melawan atau lari, yang memicu sejumlah respons fisiologis termasuk peningkatan kadar kortisol. Dalam keadaan stress, melawan atau lari justru menyebabkan masalah kesehatan lain, misalnya penambahan berat badan hingga peradangan. SCROLL TO CONTINUE WITH CONTENT Stress kronis juga merupakan penyebab kelelahan adrenal, suatu kondisi yang terjadi saat tubuh dan kelenjar adrenal berjuang untuk memenuhi tuntutan pemicu stress. Nantinya bisa menyebabkan gejala seperti, depresi dan kehilangan fokus. Untuk mengatasi hal ini, tidak semua makanan bisa menjadi solusi. Beberapa makanan perlu dihindari karena justru berdampak negatif pada kesehatan tubuh. Merangkum runtasti.com (29/03), berikut 5 jenis makanan yang sebaiknya tidak dikonsumsi saat stress: Banyak orang yang ketika stress justru mengonsumsi makanan manis. Padahal, gula adalah salah satu bahan yang perlu dihindari. Saat stress, tubuh melepaskan lebih banyak kortisol, hormon yang bertanggung jawab untuk mengelola stress dan kadar gula darah. Jika makan makanan manis, kadar gula darah melonjak, dan tubuh harus melepaskan lebih banyak kortisol untuk menyeimbangkan gula darah. Masalahnya, peningkatan kortisol juga dapat menyebabkan masalah tidur, penurunan respons imun, sakit kepala, hingga keinginan makan makanan tidak sehat meningkat. Kadar gula darah yang berfluktuasi dengan cepat juga bisa menimbulkan perasaan yang mirip seperti stress, termasuk rasa cemas dan ketakutan. Gorengan dan makanan cepat saji mungkin memang nikmat. Namun, itu justru memperburuk stress. Saat stress, tubuh perlu bekerja lebih keras untuk mencerna makanan berlemak, seperti pizza, makanan siap saji, keripik, hingga cookies. Makanan yang digoreng dan mengandung banyak lemak juga mengandung lemak lain, lemak trans. Lemak trans sendiri terbukti meningkatkan rasio LDL (kolesterol jahat) terhadap HDL (kolesterol baik) dalam darah. Peningkatan kolesterol jahat itu dikaitkan dengan peningkatan risiko penyakit, seperti jantung, diabetes, obesitas, hingga kanker. ",Food
10 Makanan Penurun Berat Badan yang Mudah Dicari dan Cocok untuk Diet,"Sabtu, 09 Des 2023 05:00 WIB","Diet menjadi salah satu cara yang bisa dilakukan untuk menurunkan berat badan. Diet yang benar bukan berarti hanya mengurangi porsi makan. Tetapi juga mengatur pola makan yang sehat dan baik. Kira-kira apa saja makanan penurun berat badan yang mudah dicari dan cocok untuk diet? Ada beberapa makanan penurun berat badan yang cocok untuk kamu jadikan menu diet. Makanan-makanan ini mengandung banyak gizi dan juga nutrisi yang baik dalam menurunkan berat badan. Berikut ini makanan penurun berat badan yang bisa secara efektif mendukung program diet kamu, dikutip dari laman Eating Well dan Eat This. Telur adalah makanan yang kaya akan protein, mineral, dan vitamin. Mineral yang terkandung dalam telur antara lain riboflavin dan selenium. Oleh karena itu, telur cocok dijadikan sebagai makanan penurun berat badan. Hal ini dibuktikan melalui sebuah penelitian yang dilakukan tahun 2020 oleh International Journal of Environmental Research and Public Health. SCROLL TO CONTINUE WITH CONTENT Penelitian tersebut menunjukkan bahwa kandungan protein yang tinggi dalam telur bisa membuat kamu merasa kenyang lebih lama. Dengan begitu, kamu tidak mudah lapar dan ngemil secara berlebihan, yang nantinya bisa memicu kenaikan berat badan. Menghilangkan kebiasaan untuk ngemil adalah tantangan terbesar yang sulit dihindari saat sedang diet. Tidak perlu khawatir, ada alternatif lain yang bisa kamu lakukan tanpa perlu menghilangkan kebiasaan ngemil. Kamu bisa memakan kacang-kacangan sebagai pengganti camilan agar lebih sehat. Kacang-kacangan mengandung protein dan serat yang cukup tinggi, kandungan ini berguna dalam membantu penurunan berat badan. Beberapa jenis kacang yang bisa digunakan antara lain kacang merah, kacang hitam, hingga lentil. Makanan penurun berat badan selanjutnya adalah ikan. Ikan banyak mengandung nutrisi penting, antara lain protein tinggi dan lemak sehat. Kandungan inilah yang bisa membantu kamu untuk merasa kenyang lebih lama. Jika kamu merasa kenyang, maka kamu akan membatasi asupan makanan dan mengurangi kebiasaan ngemil. Beberapa jenis ikan yang bisa kamu konsumsi untuk menurunkan berat yakni ikan salmon, ikan haring, dan ikan kod. Sayuran hijau menjadi makanan penurun berat badan yang bisa kamu coba saat diet. Selain mudah untuk dicari, sayuran hijau mengandung banyak nutrisi. Sayuran hijau seperti bayam, sawi, dan kangkung mengandung tilakoid, yang bisa membantu mengenyangkan dalam waktu lama. Selain itu, sayuran hijau juga rendah kalori sehingga bagus dikonsumsi untuk menjalankan program diet. Sebuah penelitian menunjukkan bahwa sayuran hijau memiliki kandungan antioksidan dan mineral yang tinggi, berguna dalam membakar lemak di tubuh. Kamu mungkin sudah tidak asing lagi menemukan alpukat ada pada semua menu diet, contohnya salad. Alpukat mengandung serat dan lemak yang baik dalam membantu menurunkan berat badan. Alpukat juga bisa membantu tubuh dalam menyerap vitamin penting yang larut ke dalam lemak. Tak hanya itu, mengonsumsi alpukat bisa membantu menurunkan kolesterol LDL dalam tubuh. Namun, perlu diperhatikan untuk mengonsumsinya secara cukup dan tidak berlebihan. Sebagian orang mungkin berpikir, untuk menurunkan berat badan, mereka harus membatasi makanan seperti nasi, roti, dan pasta. Padahal mengonsumsi gandum utuh juga bisa membantu menurunkan berat badan loh! Kamu bisa mengonsumsi gandum utuh seperti beras merah dan oat. Gandum utuh memiliki kandungan protein dan serat yang tinggi, sehingga bisa membuat kamu merasa kenyang lebih lama. Makanan penurun berat badan paling ampuh adalah yang mengandung serat. Serat berguna dalam membuat kamu merasa kenyang lebih lama, karena memperlambat proses pencernaan. Hal ini sangat penting dilakukan bagi yang ingin mengurangi kalori. Chia seed adalah makanan penurun berat badan yang cocok kamu konsumsi saat diet. Mengonsumsi chia seed kurang lebih 2 sendok makan, bisa memenuhi sekitar seperempat kebutuhan serat harian. Yoghurt menjadi makanan penurun berat badan yang cocok dikonsumsi saat diet. Yoghurt mengandung protein yang tinggi, sehingga membantu untuk merasa kenyang lebih lama. Yoghurt juga mengandung probiotik yang berfungsi untuk meningkatkan kinerja usus. Namun, usahakan untuk mengonsumsi yoghurt yang rendah gula, agar menurunkan risiko terjadinya diabetes dan obesitas. Kentang memiliki kandungan gula yang rendah, sehingga baik dikonsumsi saat sedang diet. Kentang yang diolah dengan cara direbus, bisa membuat kamu merasa kenyang lebih lama. Hal ini tentu akan membantu kamu dalam mengurangi asupan makanan yang masuk, sehingga berat badan akan tetap terjaga. Kentang rebus juga mengandung kalium yang tinggi, berfungsi untuk mengontrol tekanan darah. Makanan penurun berat badan yang terakhir adalah daging sapi tanpa lemak. Menurut berbagai penelitian yang sudah dilakukan, daging sapi tanpa lemak memiliki kandungan protein tinggi. Namun, perlu diingat untuk mengonsumsinya secara cukup dan tidak berlebihan. Mengonsumsi daging sapi dapat membakar kalori sebanyak 80 sampai 100 kalori per harinya. Melalui penjelasan di atas, bisa disimpulkan bahwa makanan penurun berat badan antara lain telur, kacang-kacangan, ikan, sayuran hijau, alpukat, gandum utuh, yoghurt, kentang rebus, dan daging sapi tanpa lemak. Demikian yang bisa kami sampaikan, semoga bermanfaat! ",Food
